name,CSDCCCode,SecId,PerformanceId,MasterPortfolioId,ISIN,obsoletedate,obsoletetype
Lion Double Income Bond Initiating Fund,320021,F00000OXSV,0P0000X7PS,,,,
Lion Dynamic Asset Alloc Mixed Type Fd,320006,F000001VWP,0P0000FX3M,,,,
Lion Equity Fund,320003,F0HKG069PV,0P00007KKM,,,,
Lion Fund Aggressive,150075,F00000NRDY,0P0000VGFI,,,,
Lion Fund CSI I & G Classified Fund,163209,F00000NRDW,0P0000VGFG,,,,
Lion Fund Steady,150073,F00000NRDX,0P0000VGFH,,,,
Lion Gaoduan Zhizao Eq,1707,F00000YX0S,0P0001AELF,,,,
Lion Global Gold Fund (QDII-FOF),320013,F00000LLLY,0P0000RW1L,,,,
Lion Global REITs Fund (QDII),320017,F00000MRZ0,0P0000TVAH,,,,
Lion Gr Sel Ret Mixed Fd,1743,F00000XNKJ,0P00018KUC,,,,
Lion Green Economy Eq,1208,F00000VP9D,0P00015UUQ,,,,
Lion Growth Fund,320007,F000002OI3,0P0000JPYW,,,,
Lion HeXin Alloc Fd,2560,F000010GUJ,0P0001DB2T,,,,
Lion HongXin Principal Guaranteed Bal Fd,66,F00000PRLQ,0P0000YF0D,,,,
Lion Huili Alloc A,5901,F000010NAC,0P0001DI8V,,,,
Lion Huili Alloc C,5902,F000010NAD,0P0001DI8W,,,,
Lion Industry Wheel Moving Bal,320015,F00000Z47G,0P0001AP75,,,,
Lion Innovation Drive Alloc A,1411,F00000VVA7,0P0001645A,,,,
Lion Innovation Drive Alloc C,2051,F00000WJOX,0P000170YY,,,,
Lion Jingxin Flxbl Alloc,2145,F00000ZWJ7,0P0001CF1J,,,,
Lion JQ Return Alloc,1744,F00000XOHI,0P00018LU1,,,,
Lion Juli Bond Fund A,736,F00000UKSG,0P00014GRA,,,,
Lion Juli Bond Fund C,737,F00000UKSH,0P00014GRB,,,,
Lion Juxinbao Money Market B,779,F00000UDBA,0P000146V4,,,,
Lion Juxinbao Money Market D,1867,F00000WC9B,0P00016PXS,,,,
Lion Juxinbao Money Market Fd A,771,F00000U567,0P00013Y7X,,,,
Lion Juxinbao Money Market Fd C,1669,F00000W593,0P00016HAL,,,,
Lion Lianchuang Shunxin Bd A,5448,F000010EGY,0P0001D62H,,,,
Lion Lianchuang Shunxin Bd C,5480,F000010EGZ,0P0001D62I,,,,
Lion LICAI MMK(money market) Fd C,1026,F00000VAOI,0P00015BIL,,,,
Lion LICAI MMK(money market) Fund A,640,F00000TEJK,0P000130RV,,,,
Lion LICAI MMK(money market) Fund B,641,F00000TFLS,0P000132OB,,,,
Lion Lixin Flxbl Alloc,2137,F00000ZVFB,0P0001CDJ9,,,,
Lion Mid-cap and small-cap Selected Fund,320011,F00000H0D2,0P0000NH0C,,,,
Lion Money Market A,320002,F0HKG05VOI,0P00007KET,,,,
Lion Money Market B,320019,F00000NR7E,0P0000VG7N,,,,
Lion Multi-strategy Fund,320016,F00000MNGR,0P0000TNW7,,,,
Lion New Economy Eq,971,F00000V766,0P000156JL,,,,
Lion New Impetus Dynamic Alloc Hybrid Fd,320018,F00000NNYD,0P0000V8VO,,,,
Lion Oil & Gas Energy Fd (QDII-FOF-LOF),163208,F00000MT3M,0P0000TXCM,,,,
Lion Optimizing Alloc,6025,F000010TPY,0P0001E0OR,,,,
Lion Optimizing Income Fund,320004,F0HKG06WZC,0P00007KM8,,,,
Lion Positive Return Alloc Fd,1706,F00000XMXG,0P00018K1Q,,,,
Lion Profit Increase Fund A,320008,F000002XNL,0P0000K7YQ,,,,
Lion Profit Increase Fund B,320009,F0000040G4,0P0000KX49,,,,
Lion Reform QuShi Alloc,1780,F00000ZB9E,0P0001BDUA,,,,
Lion Sel Return Flxbl Alloc,2067,F00000WZV6,0P00017NDE,,,,
Lion Stable Return Flexible A,714,F00000U3E2,0P00013VX1,,,,
Lion Stable Return Flexible C,2052,F00000WJOY,0P000170YZ,,,,
Lion Strategy Selected Eq,320020,F000010QPR,0P0001DWXX,,,,
Lion Study Select Equity Fd,320022,F00000VJ16,0P00015MOZ,,,,
Lion Theme Selected Fund,320012,F00000JO1M,0P0000PQL7,,,,
Lion Value Growth Fund,320005,F0HKG06Z0S,0P00007ZZ5,,,,
Lion Yixin Flxbl Alloc,2292,F0000102CU,0P0001CMNX,,,,
Lombarda China Adv Manufacture Eq A,4812,F00000ZXMQ,0P0001CGEW,,,,
Lombarda China Adv Manufacture Eq C,4813,F00000ZXMR,0P0001CGEX,,,,
Lombarda China HLYX Flxbl Alloc A,4814,F00000ZZX8,0P0001CJV4,,,,
Lombarda China HLYX Flxbl Alloc C,4815,F00000ZZX9,0P0001CJV5,,,,
Lombarda China Innov Growth Flx Alloc A,5275,F0000106MI,0P0001CSHC,,,,
Lombarda China Innov Growth Flx Alloc C,5276,F0000106MJ,0P0001CSHD,,,,
Lombarda China Jiaze Flxbl Alloc,5421,F00000ZYJP,0P0001CHFJ,,,,
Lombarda China Jurui Bd A,5419,F000010ENR,0P0001D6AD,,,,
Lombarda China Jurui Bd C,5420,F000010ENS,0P0001D6AE,,,,
Lombarda China Juxin Bd,4847,F00000ZUNA,0P0001CCIX,,,,
Lombarda China KeZhuan Bd A,4993,F00000ZGNQ,0P0001BKQF,,,,
Lombarda China KeZhuan Bd C,4994,F00000ZGNR,0P0001BKQG,,,,
Lombarda China Modern Wisdom Alloc A,5241,F00000ZZCU,0P0001CIFH,,,,
Lombarda China Modern Wisdom Alloc C,5242,F00000ZZCV,0P0001CIFI,,,,
Lombarda China Pnsn 2040 3-Y Alloc(FOF)A,6321,F0000112K5,0P0001EHI7,,,,
Lombarda China Pnsn 2040 3-Y Alloc(FOF)C,6322,F0000112K6,0P0001EHI8,,,,
Lombarda China quality Consumption Eq A,5620,F00001019J,0P0001CLDP,,,,
Lombarda China quality Consumption Eq C,5621,F00001019K,0P0001CLDQ,,,,
Lombarda China Quantified Driven Alloc,1980,F00001041S,0P0001COVY,,,,
Lombarda China YouShi Alloc,5278,F00001094Z,0P0001CX40,,,,
LombardaChina JingLing Alloc A,4734,F00000ZQAC,0P0001C600,,,,
LombardaChina JingLing Alloc C,4735,F00000ZQAD,0P0001C601,,,,
LombardaChina Open Sel Alloc A,166007,F000011AMK,0P0001EQTY,,,,
LombardaChina Open Sel Alloc E,1884,F000011AML,0P0001EQTZ,,,,
Lord Consumption Upgrades Alloc,5674,F000010894,0P0001CUBN,,,,
Lord Growth Advantage Stock Fd,570005,F0000040I2,0P0000KXBE,,,,
Lord Growth Sel Alloc A,3561,F00000YDIT,0P00019JI5,,,,
Lord Growth Sel Alloc C,3562,F00000YDIU,0P00019JI6,,,,
Lord Mid and Small Cap Stock Fd,570006,F00000IECR,0P0000O9BQ,,,,
Lord Money Market Fd A,2672,F00000X4UV,0P00017VHZ,,,,
Lord Money Market Fd B,2673,F00000X4UW,0P00017VI0,,,,
Lord New Xiang Alloc,4987,F00000ZB9G,0P0001BDUC,,,,
Lord Quant Core Flx Alloc A,6267,F000011BGF,0P0001ESJ9,,,,
Lord Quant Core Flx Alloc C,6268,F000011BGG,0P0001ESJA,,,,
Lord Quantified Bluyechip Enh Alloc A,5082,F00000ZRO0,0P0001C915,,,,
Lord Quantified Bluyechip Enh Alloc C,5083,F00000ZRO1,0P0001C916,,,,
Lord Selected 30 Stock Fd,570007,F00000M9Z1,0P0000SR0B,,,,
Lord Strengthen Income Bond Fd,573003,F000002M3S,0P0000JCSL,,,,
Lord Theme Dynamic Asset Alloc Mixed Fd,571002,F0000027HP,0P0000I5X2,,,,
Lord TianFu Alloc,5295,F00000ZOJ8,0P0001BVR4,,,,
Lord TianYi Alloc,5294,F00000ZOJ9,0P0001BVR5,,,,
Lord Value Advantage Stock Fd,570001,F0HKG070RB,0P000090DX,,,,
Lord Xinsheng Alloc,5290,F00000ZP6G,0P0001C175,,,,
Lord Xinwang Alloc,5293,F00000ZP6H,0P0001C176,,,,
MANULIFE TEDA Asia Bd(QDII)A,3463,F00000XUG1,0P00018SNK,,,,
MANULIFE TEDA Asia Bd(QDII)C,3464,F00000XUG2,0P00018SNL,,,,
MANULIFE TEDA Blue Chip Mix,1267,F00000VS5Z,0P00015ZIT,,,,
MANULIFE TEDA China Sec 500 Idx Classifi,162216,F00000N8QG,0P0000UFCB,,,,
Manulife TEDA ChuangJin Alloc Fd A,3414,F00000XRJ9,0P00018PL4,,,,
Manulife TEDA ChuangJin Alloc Fd C,3415,F00000XRJA,0P00018PL5,,,,
Manulife TEDA Chuangyi Alloc A,1418,F00000VWY1,0P00016686,,,,
Manulife TEDA Chuangyi Alloc B,2273,F00000WS70,0P00017BN7,,,,
Manulife TEDA Chuangying Alloc Fd A,1141,F00000VHRE,0P00015KL8,,,,
Manulife TEDA Chuangying Alloc Fd B,1142,F00000VHRF,0P00015KL9,,,,
MANULIFE TEDA ChunLi Bd A,3767,F00000Y5W7,0P000197B4,,,,
MANULIFE TEDA ChunLi Bd C,3768,F00000Y5W8,0P000197B5,,,,
Manulife TEDA Contrarian Strategy Eq,229002,F00000O2OB,0P0000VTRA,,,,
Manulife TEDA CSI 500 Classi Idx (Jinqu),150054,F00000N8QI,0P0000UFCD,,,,
MANULIFE TEDA DingHong Fd,3104,F00000XLLE,0P00018IIL,,,,
MANULIFE TEDA Dividend Pioneer Stk Fd,162212,F000005G1L,0P0000M5YT,,,,
MANULIFE TEDA Efficiency Sel Mixed Fd,162207,F0HKG06SWE,0P00007KL9,,,,
MANULIFE TEDA Good Growth Alloc,5903,F000010GNW,0P0001D9WJ,,,,
MANULIFE TEDA Heng Li Bd A,4001,F00000YEPL,0P00019KXX,,,,
MANULIFE TEDA Heng Li Bd C,4002,F00000YEPM,0P00019KXY,,,,
Manulife TEDA High Yield Bd(LOF),162215,F00000X85Q,0P000181EF,,,,
MANULIFE TEDA HK Select Eq A,4482,F00000YS43,0P0001A3NG,,,,
MANULIFE TEDA HK Select Eq C,4483,F00000YS44,0P0001A3NH,,,,
MANULIFE TEDA HongDa Alloc A,507,F00000SINA,0P00011UQZ,,,,
MANULIFE TEDA HongDa Alloc B,508,F00000SINB,0P00011UR0,,,,
MANULIFE TEDA HS300 Enhanced Index A,162213,F0000108YK,0P0001CWWI,,,,
MANULIFE TEDA HS300 Enhanced Index C,3548,F0000108YL,0P0001CWWJ,,,,
MANULIFE TEDA HuiLi Bd A,3073,F00000XMCX,0P00018JEJ,,,,
MANULIFE TEDA HuiLi Bd C,3074,F00000XMCY,0P00018JEK,,,,
MANULIFE TEDA Huoqiyou MMkt A,1894,F00000WECA,0P00016TGP,,,,
MANULIFE TEDA Huoqiyou MMkt B,1895,F00000WECB,0P00016TGQ,,,,
MANULIFE TEDA Industry Selected Fd,162204,F0HKG05VSM,0P00007KEM,,,,
MANULIFE TEDA JingYuanB MMF A,3711,F00000Y5L3,0P000196SW,,,,
MANULIFE TEDA JingYuanB MMF B,3712,F00000Y5L4,0P000196SX,,,,
MANULIFE TEDA Leading Mid&Small-cap Stk,162214,F00000LOSL,0P0000S1IV,,,,
MANULIFE TEDA LiangHua Enhance Stk,1733,F00000XJYE,0P00018FZ0,,,,
MANULIFE TEDA Market Value Sel Stk Fd,162209,F000000JBG,0P00009P4X,,,,
MANULIFE TEDA Money Market A,162206,F0HKG0642G,0P00007KKE,,,,
MANULIFE TEDA Money Market B,700,F00000U2AJ,0P00013TXP,,,,
MANULIFE TEDA New Idea mix A,1419,F00000VW8I,0P000165CI,,,,
MANULIFE TEDA New Idea mix B,2314,F00000WS71,0P00017BN8,,,,
MANULIFE TEDA New Start Flxbl Alloc A,1254,F00000VQO9,0P00015XD1,,,,
MANULIFE TEDA New Start Flxbl Alloc B,2313,F00000WS72,0P00017BN9,,,,
MANULIFE TEDA Preferred Enterprises Stk,162208,F0HKG06Z3X,0P00007ZXP,,,,
MANULIFE TEDA QiFu Alloc A,3912,F00000YM2J,0P00019UPR,,,,
MANULIFE TEDA QiFu Alloc C,3913,F00000YM2K,0P00019UPS,,,,
MANULIFE TEDA QiZhi Alloc A,3247,F00000XMX8,0P00018K1I,,,,
MANULIFE TEDA QiZhi Alloc C,3248,F00000XMX9,0P00018K1J,,,,
MANULIFE TEDA QN Select Alloc(FOF)A,5221,F00000ZJJB,0P0001BP1Z,,,,
MANULIFE TEDA QN Select Alloc(FOF)C,5222,F00000ZJJC,0P0001BP20,,,,
MANULIFE TEDA Qual Life Dyn Asset Allc,162211,F000002PIL,0P0000JSD6,,,,
MANULIFE TEDA Reform Drive Strategy Fd A,1017,F00000V8Y3,0P00015980,,,,
MANULIFE TEDA Reform Drive Strategy Fd C,3550,F00000YI3E,0P00019PRD,,,,
MANULIFE TEDA Renaissance Biz Alloc Fd,1170,F00000VL3G,0P00015P0D,,,,
MANULIFE TEDA Risk Budget Mixed Type Fd,162205,F0HKG05VSI,0P00007KGX,,,,
MANULIFE TEDA RuiXuan Stable Alloc,4000,F00000YC3S,0P00019HHD,,,,
MANULIFE TEDA RuiZhi WJ Alloc,3501,F00000XX5Z,0P00018WDR,,,,
Manulife TEDA Stable Fd,150053,F00000N8QH,0P0000UFCC,,,,
MANULIFE TEDA Taihe Bl Pnsn Tgt3y Alloc,6306,F0000112K7,0P0001EHI9,,,,
MANULIFE TEDA Taoli Bond A,319,F00000TVW2,0P00013MV9,,,,
MANULIFE TEDA Taoli Bond C,320,F00000TVW3,0P00013MVA,,,,
MANULIFE TEDA Total Return Bond Fd A,162210,F000002587,0P0000HS5T,,,,
MANULIFE TEDA Total Return Bond Fd C,162299,F000002588,0P0000HS5U,,,,
Manulife TEDA Trsfmtn Opportunity Eq Fd,828,F00000ULB6,0P00014HCP,,,,
MANULIFE TEDA ts Lre dta Sel Flle Alc A,2263,F00000WPWV,0P0001785M,,,,
MANULIFE TEDA ts Lre dta Sel Flle Alc C,3554,F00000YI3G,0P00019PRF,,,,
MANULIFE TEDA Value Opt Cycle Industry,162202,F0HKG05VQN,0P00007KFR,,,,
MANULIFE TEDA Value Opt Gr Industry,162201,F0HKG05VR5,0P00007KG5,,,,
MANULIFE TEDA Value Opt Sustaining Indus,162203,F0HKG05VQE,0P00007KFM,,,,
MANULIFE TEDA YeJi QuDong LH Eq A,4484,F00000ZC4E,0P0001BEWL,,,,
MANULIFE TEDA YeJi QuDong LH Eq C,4485,F00000ZC4F,0P0001BEWM,,,,
MANULIFE TEDA Yi Li Bd A,3793,F00000YEPJ,0P00019KXV,,,,
MANULIFE TEDA Yi Li Bd C,3794,F00000YEPK,0P00019KXW,,,,
Maxwealth Chengyi Bd A,6576,F000011EPE,0P0001EW9R,,,,
Maxwealth Chengyi Bd C,6577,F000011EPF,0P0001EW9S,,,,
Maxwealth Consume Theme Flx Alloc A,6252,F0000118OJ,0P0001EOHJ,,,,
Maxwealth Consume Theme Flx Alloc C,6253,F0000118OK,0P0001EOHK,,,,
Maxwealth Daily Li MMKT Fd,4545,F00000YT2D,0P0001A4V4,,,,
Maxwealth FengLi Bd A,5507,F00000ZWX8,0P0001CFMJ,,,,
Maxwealth FengLi Bd C,5508,F00000ZWX9,0P0001CFMK,,,,
Maxwealth FengYi Bd,3898,F00000Y8J7,0P00019B3D,,,,
Maxwealth HengYi Bd,5705,F0000107PF,0P0001CTOF,,,,
Maxwealth Huitianli Flxbl Alloc,5711,F000010DWV,0P0001D5DQ,,,,
Maxwealth Huiyi Bd A,6043,F000010JBW,0P0001DDOU,,,,
Maxwealth Huiyi Bd C,6044,F000010JBX,0P0001DDOV,,,,
Maxwealth Jiayi Bd,6237,F000010U4G,0P0001E17K,,,,
Maxwealth Juyi Bd A,6275,F000010VNQ,0P0001E4IQ,,,,
Maxwealth Juyi Bd C,6276,F000010VNR,0P0001E4IR,,,,
Maxwealth MMkt Fd,533,F00000SIUB,0P00011V57,,,,
Maxwealth Rongyi Bd A,6092,F000010NGL,0P0001DIH9,,,,
Maxwealth Rongyi Bd C,6093,F000010NGM,0P0001DIHA,,,,
Maxwealth RuiYi Bd,4238,F00000YFYZ,0P00019MHG,,,,
Maxwealth Runyi Bd A,6088,F000010SVS,0P0001DZLR,,,,
Maxwealth Runyi Bd C,6089,F000010SVT,0P0001DZLS,,,,
Maxwealth Shengyi Bd A,6287,F000010Z7E,0P0001EDFC,,,,
Maxwealth Shengyi Bd C,6288,F000010Z7F,0P0001EDFD,,,,
Maxwealth Shuangli Bond A,2521,F00000X4UZ,0P00017VI3,,,,
Maxwealth Shuangli Bond C,2522,F00000X4V1,0P00017VI5,,,,
Maxwealth Sustaining Inc Bd,2169,F00000WJZ8,0P000171BM,,,,
Maxwealth Taiyi Bd A,6094,F000010NGN,0P0001DIHB,,,,
Maxwealth Taiyi Bd C,6095,F000010NGO,0P0001DIHC,,,,
Maxwealth TianYi Bd,4230,F00000YF3Q,0P00019LF7,,,,
Maxwealth Tongyi Bd A,6558,F000011EIG,0P0001EW21,,,,
Maxwealth Tongyi Bd C,6559,F000011EIH,0P0001EW22,,,,
Maxwealth Xiangyi Bd A,6505,F0000118ZU,0P0001EOTV,,,,
Maxwealth Xiangyi Bd C,6506,F0000118ZV,0P0001EOTW,,,,
Maxwealth Yingyi Bd A,6186,F000010S7D,0P0001DYSC,,,,
Maxwealth Yingyi Bd C,6187,F000010S7E,0P0001DYSD,,,,
Maxwealth YongYi Bd A,5073,F00000ZDN9,0P0001BGWM,,,,
Maxwealth YongYi Bd C,5074,F00000ZDNA,0P0001BGWN,,,,
Maxwealth Yuyi Bd A,6443,F0000115A7,0P0001EKMH,,,,
Maxwealth Yuyi Bd C,6444,F0000115A8,0P0001EKMI,,,,
Maxwealth Zengyi Bd A,5703,F0000104FH,0P0001CPEJ,,,,
Maxwealth Zengyi Bd C,5704,F0000104FI,0P0001CPEK,,,,
Min Sheng Royal Brand Blue Chip Dyn Allc,690001,F000002OOU,0P0000JQLP,,,,
Min Sheng Royal Cash Treasure MMkt Fd A,371,F00000QJA6,0P0000ZQ34,,,,
Min Sheng Royal Cash Treasure MMkt Fd C,3792,F00000YVT9,0P0001AC3E,,,,
Min Sheng Royal Domestic Demand Gr Stk,690005,F00000LO27,0P0000RZGQ,,,,
Min Sheng Royal Pension Serv Alloc,2547,F00000XOHH,0P00018LU0,,,,
Min Sheng Royal Prosperity Industry Stk,690007,F00000N7EF,0P0000UDWD,,,,
Min Sheng Royal Selected Stock Fd,690003,F000005LOZ,0P0000MWCU,,,,
Min Sheng Royal Sustaining Growth Stk Fd,690004,F00000IECK,0P0000O9AQ,,,,
Min Sheng Royal Urbanization Mixed Fd,408,F00000QOG1,0P0000ZWNL,,,,
Min Sheng Royal XinAn Bd A,2684,F00000XNWN,0P00018L7Y,,,,
Min Sheng Royal XinAn Bd C,3173,F00000XNWO,0P00018L7Z,,,,
MinSheng Emerging Growth Alloc,6058,F000010U4H,0P0001E17L,,,,
MinSheng HK Stocks High Divid Sele Ind A,4532,F00000YVTA,0P0001AC3F,,,,
MinSheng HK Stocks High Divid Sele Ind C,4533,F00000YVTB,0P0001AC3G,,,,
MinSheng Jiayin Hengyi Pure Bd A,5951,F000010N28,0P0001DI04,,,,
MinSheng Jiayin Hengyi Pure Bd C,5952,F000010N29,0P0001DI05,,,,
MinSheng JiaYin PengCheng Alloc,4710,F00000ZPM8,0P0001C2M2,,,,
MinSheng New Stratgy mix,1352,F00000VUHI,0P000162ZG,,,,
Minsheng Royal Bonus Ret Flex Bal Sec Fd,690009,F00000OJAE,0P0000WG8A,,,,
MinSheng Royal Cash Profit Inc MMkt Fd A,690010,F00000P5RA,0P0000XK1Y,,,,
MinSheng Royal Cash Profit Inc MMkt Fd B,690210,F00000P5RB,0P0000XK1Z,,,,
MinSheng Royal Cash Profit Inc MMkt Fd D,1240,F00000VP3U,0P00015ULI,,,,
MinSheng Royal Convertible Selected Bd A,67,F00000PONF,0P0000YAIB,,,,
MinSheng Royal Convertible Selected Bd C,68,F00000PONG,0P0000YAIC,,,,
Minsheng Royal Credit Doub Benefit Bd A,690006,F00000O078,0P0000VQXU,,,,
Minsheng Royal Credit Doub Benefit Bd C,690206,F00000O079,0P0000VQXV,,,,
Minsheng Royal CSI CHN Mainld Nat Res Id,690008,F00000NOLA,0P0000VA6I,,,,
MinSheng Royal JiaYing 7 Days Bd Fd A,690012,F00000PFX0,0P0000XYDI,,,,
MinSheng Royal JiaYing 7 Days Bond Fd B,690212,F00000PFX1,0P0000XYDJ,,,,
MinSheng Royal JiaYing Monthly Bd E,715,F00000U3E4,0P00013VX3,,,,
MinSheng Royal JiaYing Monthly Bd Fd A,89,F00000PT1D,0P0000YI7Y,,,,
MinSheng Royal JiaYing Monthly Bd Fd B,90,F00000PT1E,0P0000YI7Z,,,,
MinSheng Royal New Power Alloc A,1273,F00000X9QE,0P000183C9,,,,
MinSheng Royal Positive Growth Bal Fd,690011,F00000PBBA,0P0000XSUU,,,,
MinSheng Royal Quantified China Alloc Fd,2449,F00000X2XL,0P00017SKO,,,,
MinSheng Royal Selected Eq,884,F00000UPUG,0P00014N9K,,,,
MinSheng Royal Strat Sel FlexCnfigr Bal,136,F00000PWBT,0P0000YR3Y,,,,
MinSheng Royal Strengthen Income Bd A,690002,F000003T1I,0P0000KBYM,,,,
MinSheng Royal Strengthen Income Bd C,690202,F000003T1A,0P0000KBYF,,,,
Minsheng Royal Study Sele Alloc Fd,1220,F00000VP9G,0P00015UUT,,,,
Minsheng Royal Technology QianYan Alloc,2683,F00000XUFV,0P00018SNE,,,,
MinSheng Royal TengYuan MMkt A,3478,F00000XSUQ,0P00018R1N,,,,
MinSheng Royal TengYuan MMkt B,4589,F00000YV9G,0P0001AB1P,,,,
Minsheng Royal Xinsheng Pure Bd,4124,F00000YETL,0P00019L2J,,,,
MinSheng XinFu Alloc Fd,2518,F00000XL8F,0P00018HX1,,,,
MinSheng XinXi Alloc,2455,F00000Y7XR,0P000199S8,,,,
MinSheng XinXiang Bd A,3382,F00000XQC3,0P00018O2Q,,,,
MinSheng XinXiang Bd C,3383,F00000XQC4,0P00018O2R,,,,
MinSheng XinYuan Pure Bd A,3656,F00000YOYZ,0P00019Z16,,,,
MinSheng XinYuan Pure Bd C,3657,F00000YOZ0,0P00019Z17,,,,
MinSheng ZhiZhao 2025 Alloc,2649,F00000ZQN1,0P0001C6K5,,,,
Mordan Stanley Huaxin Consump Nav Mixed,233008,F00000JYBL,0P0000Q6D5,,,,
Mordan Stanley Huaxin Leading Adv Stk Fd,233006,F000003YWE,0P0000KUA8,,,,
Morgan Stanley Huaxin Aggre Gr Sel Eq Fd,594,F00000T90F,0P00012UG4,,,,
Morgan Stanley Huaxin Basic Industry,233001,F0HKG05VRI,0P00007KGC,,,,
Morgan Stanley Huaxin Excellent Gr Stk,233007,F00000H344,0P0000NN33,,,,
Morgan Stanley HuaXin Multiple Inc Bd A,233012,F00000OLUA,0P0000WJD1,,,,
Morgan Stanley HuaXin Multiple Inc Bd C,233013,F00000OLUB,0P0000WJD2,,,,
Morgan Stanley Huaxin Quality Life Sel,309,F00000QFF3,0P0000ZJOJ,,,,
Morgan Stanley HuaXin Quant Alloc Eq Fd,233015,F00000OZXQ,0P0000XAK8,,,,
Morgan Stanley Huaxin RC Small-cap Eq,3312,F00000Y5L2,0P000196SV,,,,
Morgan Stanley Huaxin Resource Sel(LOF),163302,F0HKG0632H,0P00007KKC,,,,
Morgan Stanley Huaxin Strengthen Inc Bd,233005,F000005HDS,0P0000MLLP,,,,
Morgan Stanley Huaxin SZSE 300 Idx Stre,233010,F00000N0YU,0P0000U6NW,,,,
Morgan Stanley HuaXin Theme Sel Eq Fd,233011,F00000NP27,0P0000VBXA,,,,
Morgan Stanley HX Health Industry,2708,F00000X9G7,0P000182ZP,,,,
Morgan Stanley HX Mlti Ftr Sel Str Stk,233009,F00000MBCY,0P0000SUEF,,,,
Morgan Stanley HX New Chance mix,1348,F00000VUHK,0P000162ZI,,,,
Morgan Stanley HX New Tendency Alloc,1738,F00000ZN95,0P0001BU8S,,,,
Morgan Stanley HX Quant Gr Strat Eq,1291,F00000VT9X,0P000161GT,,,,
Morgan Stanley HX Tech LX Alloc,2707,F00000ZPFW,0P0001C2CJ,,,,
Morgan Stanley HX WZ chuangxin Alloc,2885,F00000ZN94,0P0001BU8R,,,,
Morgan Stanley HX Xinjia Pure Bd Fd A,419,F00000UNG8,0P00014JR1,,,,
Morgan Stanley HX Xinjia Pure Bd Fd C,420,F00000UNG9,0P00014JR2,,,,
MS HuaXin Dual-Benefit Enhanced Ret Bd A,24,F00000PJWF,0P0000Y3WM,,,,
MS HuaXin Dual-Benefit Enhanced Ret Bd C,25,F00000PJWG,0P0000Y3WN,,,,
NANHUA FengChun Bal A,5296,F00000ZREJ,0P0001C8R3,,,,
NANHUA FengChun Bal C,5297,F00000ZREK,0P0001C8R4,,,,
NANHUA Fenghe Alloc A,5012,F0000110FH,0P0001EEYA,,,,
NANHUA Fenghe Alloc C,5013,F0000110FI,0P0001EEYB,,,,
NANHUA Ruiyi Alloc A,5047,F00000ZRU0,0P0001C97L,,,,
NANHUA Ruiyi Alloc C,5048,F00000ZRU1,0P0001C97M,,,,
NANHUA RuiYing Alloc A,4845,F00000Z6ZM,0P0001B92M,,,,
NANHUA RuiYing Alloc C,4846,F00000Z6ZN,0P0001B92N,,,,
NANHUA XianJinBao MMKt A,5086,F00000ZGRW,0P0001BKV1,,,,
NANHUA XianJinBao MMKt B,5087,F00000ZGRX,0P0001BKV2,,,,
New China CSI Envirnmt Protect Ind Idx A,150190,F00000U2AY,0P00013TY4,,,,
New China CSI Envirnmt Protect Ind Idx B,150191,F00000U2AZ,0P00013TY5,,,,
New China CSI Envirnmt Protect Inds Idx,164304,F00000U2AX,0P00013TY3,,,,
New China Diamond Quality Enterp Stk,519093,F000005MPM,0P0000MXQR,,,,
New China Enhance Pure Bond Fund A,519152,F00000P2QP,0P0000XF7O,,,,
New China Enhance Pure Bond Fund C,519153,F00000P2QQ,0P0000XF7P,,,,
New China Enhanced Bd A,2421,F00000ZWD6,0P0001CESI,,,,
New China Enhanced Bd C,2422,F00000ZWD7,0P0001CESJ,,,,
New China FengLi Bd A,3221,F00000XPQ0,0P00018NDS,,,,
New China FengLi Bd C,3222,F00000XPQ1,0P00018NDT,,,,
New China FengYing Return Bond,2866,F00000XB6L,0P0001850U,,,,
New China Flexible Theme Stock Fd,519099,F00000MI2D,0P0000TFQT,,,,
New China GaoDuan ZhiZao Alloc,2968,F00000Z1AX,0P0001ALHP,,,,
New China HengWen TianLi Bond,2867,F00000XJA8,0P00018EB8,,,,
New China HengYi LiangHua Alloc,4576,F00000ZBFL,0P0001BE1C,,,,
New China HongLi Return Alloc,3025,F00000YCVJ,0P00019IR2,,,,
New China HuaFeng Alloc,4565,F00000ZKYH,0P0001BR0E,,,,
New China HuaRui Alloc,3738,F00000YCK1,0P00019IE0,,,,
New China Huixin Bd(LOF) A,5673,F000010367,0P0001CNNM,,,,
New China Huixin Bd(LOF) C,164302,F00000YGND,0P00019NJI,,,,
New China Huoqi Tianli MMkt Fund A,903,F00000V1EG,0P00014Z50,,,,
New China Huoqi Tianli MMkt Fund B,3264,F00000XNLL,0P00018KVE,,,,
New China Huoqi Tianli MMkt Fund E,5148,F00000ZGJK,0P0001BKM4,,,,
New China Industry Cycle Switch Stk Fd,519095,F00000ISQ0,0P0000OP9P,,,,
New China Positive Value Alloc,1681,F00000WJ0B,0P0001706N,,,,
New China Profit Inc Ret Bond,973,F00000V6D1,0P000155LJ,,,,
New China Res Advanced Dyn Asset Alloc,519091,F000003T1G,0P0000KBYL,,,,
New China Sec Rotation Flex-Config Bal A,519156,F00000PWXB,0P0000YRW5,,,,
New China Sec Rotation Flex-Config Bal C,519157,F00000W53X,0P00016H5B,,,,
New China Sel low vola Eq,519167,F000010393,0P0001CNQP,,,,
New China Selected Consumer Stock Fund,519150,F00000O7SV,0P0000W40Z,,,,
New China Selected Dividend Mixed Type,519087,F0HKG061F1,0P00007KK4,,,,
New China Selected Growth Stock Fd,519089,F00000218N,0P0000GBQN,,,,
New China Shuangli Bond A,2765,F00000X92Z,0P000182JW,,,,
New China Shuangli Bond C,2766,F00000X930,0P000182JX,,,,
New China Sma&Medium Mkt Value Sel Stk,519097,F00000LOSM,0P0000S1IW,,,,
New China Stable Return mix,1004,F00000VSAS,0P0001606W,,,,
New China Strategic Emerg Indstry Bal,1294,F00000VV5K,0P000163XI,,,,
New China Strategy Select Eq,1040,F00000VEXN,0P00015H5N,,,,
New China Tech Creative Alloc Fd,2272,F00000WTBH,0P00017CYJ,,,,
New China Trend Leading Eq,519158,F00000Q9V2,0P0000Z9TY,,,,
New China WaiYan Increase Them Alloc,3238,F00000YFBN,0P00019LO1,,,,
New China Wanyin Duoyuan Strtgy Alloc Fd,972,F00000VEXM,0P00015H5M,,,,
New China Xin Energy Flxbl Alloc A,2083,F00000X65N,0P00017YJO,,,,
New China Xin Energy Flxbl Alloc C,2084,F00000X65O,0P00017YJP,,,,
New China Xin Return mix,1682,F00000W5P6,0P00016I0R,,,,
New China XinHong Flexible Alloc Fd,3739,F00000Y5W9,0P000197B6,,,,
New China Xinli Flexible Alloc Fd,519165,F00000T3Z5,0P00012MNY,,,,
New China XinRui Alloc,1622,F00000XUFY,0P00018SNH,,,,
New China XinTai Alloc,4573,F00000Z0UR,0P0001AKYI,,,,
New China Xinyi Flexible Alloc Fd,584,F00000SXAS,0P00012D3Y,,,,
New China Yiruobao MMkt Fd A,434,F00000QTGN,0P000102GF,,,,
New China Yiruobao MMkt Fd B,3267,F00000XXS6,0P00018X6E,,,,
New China Zengyi Bd A,519162,F00000ZWD4,0P0001CESG,,,,
New China Zengyi Bd C,519163,F00000ZWD5,0P0001CESH,,,,
Orient Alpha Sel Flx Alloc A,5358,F0000102PC,0P0001CN54,,,,
Orient Alpha Sel Flx Alloc C,5359,F0000102PD,0P0001CN55,,,,
Orient area Development Fd,1614,F00000XIN6,0P00018DMJ,,,,
Orient Atficil Intll Theme Alloc,5844,F000010GTX,0P0001DAP7,,,,
Orient Big Healthy Mix,2173,F00000WQQP,0P000179WE,,,,
Orient Core Dynamic Stock Fd,400011,F000003T1F,0P0000KBYK,,,,
Orient Cycle Select Alloc,4244,F00000YG6E,0P00019MPW,,,,
Orient Dble Bd Inc Bd A,400027,F00000U5UQ,0P00013Z1L,,,,
Orient Dble Bd Inc Bd C,400029,F00000U5UR,0P00013Z1M,,,,
Orient Dingxin Flxbl Alloc Fd A,1196,F00000VN0Y,0P00015R98,,,,
Orient Dingxin Flxbl Alloc Fd C,2192,F00000X3WL,0P00017U0T,,,,
Orient Dragon Mixed Type Open-Ended Fd,400001,F0HKG05VTG,0P00007KHB,,,,
Orient Emerging Growth Alloc,400025,F00000U394,0P00013VQS,,,,
Orient Enhenced Income Fund,400016,F00000OQL3,0P0000WVNE,,,,
Orient Golden Account Book Money Mkt A,400005,F0HKG06XJ3,0P00007KMU,,,,
Orient Golden Account Book Money Mkt B,400006,F00000UKNI,0P00014GHT,,,,
Orient Growth Income Flx Alloc,400013,F0000100OM,0P0001CKNE,,,,
Orient Huixin Flxbl Alloc A,1198,F00000VN0X,0P00015R97,,,,
Orient Huixin Flxbl Alloc C,2163,F00000WJYU,0P000171B7,,,,
Orient Innovation Technology Balance Fd,1702,F00000W53M,0P00016H50,,,,
Orient Internet Jia mix,2174,F00000WWSV,0P00017JOM,,,,
Orient JinZhengTong MMF,2243,F00000WYPT,0P00017M4F,,,,
Orient Kingyuan MMkt,1987,F00000WJ08,0P0001706K,,,,
Orient LiQun Balance Fund A,400022,F00000Q1BO,0P0000YYWJ,,,,
Orient LiQun Balance Fund C,2193,F00000X3WK,0P00017U0S,,,,
Orient MingFeng Return YA Bal A,4005,F00000ZHCZ,0P0001BLI6,,,,
Orient MingFeng Return YA Bal C,4006,F00000ZHD0,0P0001BLI7,,,,
Orient Multi-strategy Alloc A,400023,F00000TF55,0P000131TY,,,,
Orient Multi-strategy Alloc C,2068,F00000WJ09,0P0001706L,,,,
Orient New Energy Flex-Configrtn Bal Fd,480,F00000SCHH,0P00011MQ2,,,,
Orient New Idea Flxbl Alloc A,1384,F00000VV5Q,0P000163XO,,,,
Orient New Idea Flxbl Alloc C,1385,F00000VV5R,0P000163XP,,,,
Orient New Strategy mix A,1318,F00000VT1F,0P0001617O,,,,
Orient New Strategy mix C,2060,F00000WJ0A,0P0001706M,,,,
Orient New Value Flxbl Alloc A,1495,F00000VZ1M,0P00016942,,,,
Orient New Value Flxbl Alloc C,2162,F00000WJYV,0P000171B8,,,,
Orient Pillar Economy Alloc,4205,F00000YVF3,0P0001ABM0,,,,
Orient Qiming Quantified Pioneer Mix,400018,F00000WLK3,0P0001734U,,,,
Orient Quantified Growth Flx Alloc,5616,F0000102Z6,0P0001CNFU,,,,
Orient Ruixin Hotspot Discover Alloc A,1120,F00000VHKX,0P00015KAB,,,,
Orient Ruixin Hotspot Discover Alloc C,1121,F00000VHKY,0P00015KAC,,,,
Orient Secs Advantage Sel Alloc,1712,F00000W5JK,0P00016HUL,,,,
Orient Secs China Advantage Alloc Fd,1112,F00000VIEE,0P00015LUA,,,,
Orient Secs Credit Bd A,1945,F00000WH0H,0P00016X97,,,,
Orient Secs Credit Bd C,1946,F00000WH0I,0P00016X98,,,,
Orient Secs Green Energy Car Alloc,400015,F000010P7M,0P0001DKHI,,,,
Orient Secs HuiLi Bond A,2651,F00000X72I,0P00017ZX9,,,,
Orient Secs HuiLi Bond C,2652,F00000X72J,0P00017ZXA,,,,
Orient Secs HuiYang Bond A,2701,F00000X50G,0P00017VYC,,,,
Orient Secs HuiYang Bond C,2702,F00000X50H,0P00017VYD,,,,
Orient Secs HuiYang Bond Z,5008,F00000ZFHS,0P0001BJBO,,,,
Orient Secs Income Enhanced Bd A,1862,F00000WF3Q,0P00016UI3,,,,
Orient Secs Income Enhanced Bd C,1863,F00000WF3R,0P00016UI4,,,,
Orient Secs Indus Upgr Flex-Cfigr Bal Fd,619,F00000TEJJ,0P000130RU,,,,
Orient Secs JingDong Large data Flxbl Fd,1564,F00000W1NQ,0P00016CUF,,,,
Orient Secs Lead Sel Flxbl Alloc Fd,1202,F00000VN0Z,0P00015R99,,,,
Orient Secs MMKT A,5056,F00000ZEED,0P0001BHYY,,,,
Orient Secs MMKT B,5057,F00000ZEEE,0P0001BHYZ,,,,
Orient Secs MMKT E,5058,F00000ZEEF,0P0001BHZ0,,,,
Orient Secs Ruifeng Dyn Asset Alloc(LOF),169101,F00000ZI32,0P0001BMSJ,,,,
Orient Secs Ruiyang Flxbl Alloc (LOF),169102,F000010174,0P0001CLAT,,,,
Orient Secs Sele Alloc Fd A,5974,F000010GNT,0P0001D9WG,,,,
Orient Secs Sele Alloc Fd C,5975,F000010GNU,0P0001D9WH,,,,
