name,CSDCCCode,SecId,PerformanceId,MasterPortfolioId,ISIN,obsoletedate,obsoletetype
Essence Made In China 2025 SHS Alloc,4249,F00000YIIY,0P00019Q8B,,,,
Essence New Growth Alloc A,3345,F00000XQC5,0P00018O2S,,,,
Essence New Growth Alloc C,3346,F00000XQC6,0P00018O2T,,,,
Essence New Normal SHS Sel Eq,1583,F00000W073,0P00016AJO,,,,
Essence New Power Alloc A,1686,F00000WJFD,0P000170O2,,,,
Essence New Power Alloc C,1687,F00000WJFE,0P000170O3,,,,
Essence New Return Alloc A,2770,F00000X65T,0P00017YJU,,,,
Essence New Return Alloc C,2771,F00000X65U,0P00017YJV,,,,
Essence New Selected mix A,3028,F00000XIF9,0P00018DDW,,,,
Essence New Selected mix C,3029,F00000XIFA,0P00018DDX,,,,
Essence New Traget mix A,3030,F00000XJL8,0P00018EXH,,,,
Essence New Traget mix C,3031,F00000XJL9,0P00018EXN,,,,
Essence New Trend Flxbl Alloc A,1710,F00000Y6IA,0P0001981G,,,,
Essence New Trend Flxbl Alloc C,1711,F00000Y6IB,0P0001981H,,,,
Essence New Value mix A,3026,F00000XKSC,0P00018HA4,,,,
Essence New Value mix C,3027,F00000XKSD,0P00018HA5,,,,
Essence New View Alloc A,3895,F00000Y82F,0P00019A60,,,,
Essence New View Alloc C,3896,F00000Y82G,0P00019A61,,,,
Essence Quant Fatr Alloc A,4592,F00000YXM7,0P0001AFDM,,,,
Essence Quant Fatr Alloc C,5697,F0000106EU,0P0001CS6F,,,,
Essence Quant Sel Eq A,6346,F000010Z79,0P0001EDF7,,,,
Essence Quant Sel Eq C,6347,F000010Z7A,0P0001EDF8,,,,
Essence Relative Advtg Flx Alloc,5587,F0000103DN,0P0001CNVV,,,,
Essence Renaissance CSI100 Index Fund A,5807,F000010F79,0P0001D727,,,,
Essence Renaissance CSI101 Index Fund C,5808,F000010F7A,0P0001D728,,,,
Essence Stable Income Balance A,750005,F00000P2CD,0P0000XDGY,,,,
Essence Stable Income Balance C,2035,F00000WJOZ,0P000170Z0,,,,
Essence Traget Income Bond Fund A,750002,F00000OPO4,0P0000WUGM,,,,
Essence Traget Income Bond Fund C,750003,F00000OPO5,0P0000WUGN,,,,
Essence Value Selection Equity Fd,577,F00000SY7P,0P00012E3I,,,,
Essence Xinan Inc Flxbl Alloc A,1399,F00000VV5T,0P000163XR,,,,
Essence Xinan Inc Flxbl Alloc C,1400,F00000VV5U,0P000163XS,,,,
Essence Xinfa Selected Balance Fd,433,F00000S6N8,0P00011GE7,,,,
Essence Yongxin Enhanced Bd A,3637,F000010NXA,0P0001DJ02,,,,
Essence Yongxin Enhanced Bd C,3638,F000010NXB,0P0001DJ03,,,,
Essence ZunXiang Pure Bd,3395,F00000XQZ1,0P00018OT1,,,,
Essence Zunxiang Tianyi Bd,5678,F000010476,0P0001CP5T,,,,
Everbright Event Drive Alloc,3704,F00000YBGE,0P00019GE3,,,,
Everbright Made In China 2025 Alloc,1740,F00000WJZ3,0P000171BG,,,,
Everbright Pramerica Advantage Alloc Stk,360007,F000000IRP,0P00009NN4,,,,
Everbright Pramerica AnChen Bd A,3197,F00000YFSS,0P00019M6Y,,,,
Everbright Pramerica AnChen Bd C,3198,F00000YFST,0P00019M6Z,,,,
Everbright Pramerica AnHe Bd A,3109,F00000Y82J,0P00019A64,,,,
Everbright Pramerica AnHe Bd C,3110,F00000Y82K,0P00019A65,,,,
Everbright Pramerica AnQi Bd A,3107,F00000YDIV,0P00019JI7,,,,
Everbright Pramerica AnQi Bd C,3108,F00000YDIW,0P00019JI8,,,,
Everbright Pramerica Anze Bd A,5656,F000010QPM,0P0001DWXS,,,,
Everbright Pramerica Anze Bd C,5657,F000010QPN,0P0001DWXT,,,,
Everbright Pramerica Cash Box MMkt Fd A,210,F00000QB38,0P0000ZBI6,,,,
Everbright Pramerica Cash Box MMkt Fd B,211,F00000QB39,0P0000ZBI7,,,,
Everbright Pramerica Chaoduanzhai Bd A,5992,F000010KMZ,0P0001DF2O,,,,
Everbright Pramerica Chaoduanzhai Bd C,5993,F000010KN0,0P0001DF2P,,,,
Everbright Pramerica ChenXin Alloc A,3115,F00000Y8AH,0P00019AIF,,,,
Everbright Pramerica ChenXin Alloc C,3116,F00000Y8AI,0P00019AIG,,,,
Everbright Pramerica ChiNext Quan Sel Eq,3069,F00000ZWHU,0P0001CF01,,,,
Everbright Pramerica Credit Bond Fund A,360013,F00000MB7V,0P0000STW8,,,,
Everbright Pramerica Credit Bond Fund C,360014,F00000MB7W,0P0000STW9,,,,
Everbright Pramerica Dep Agreement No2 A,360019,F00000OUIX,0P0000X3TE,,,,
Everbright Pramerica Dep Agreement No2 B,360020,F00000OUIY,0P0000X3TF,,,,
Everbright Pramerica Dingxin mix A,1464,F00000VWQ9,0P000165ZT,,,,
Everbright Pramerica Dingxin mix C,1823,F00000WIMH,0P00016ZMB,,,,
Everbright Pramerica Dividend Stock Fd,360005,F0HKG06PEY,0P00007KKV,,,,
Everbright Pramerica Enhanced Yld Bd A,360008,F0000026YG,0P0000I3YI,,,,
Everbright Pramerica Enhanced Yld Bd C,360009,F0000026YH,0P0000I3YJ,,,,
Everbright Pramerica Equilibrium Sel Stk,360010,F000002M3W,0P0000JCSS,,,,
Everbright Pramerica HengLi Pure Bd,2523,F00000XN34,0P00018K8G,,,,
Everbright Pramerica Industy New Drve Fd,2772,F00000XLLD,0P00018IIK,,,,
Everbright Pramerica Jixin Alloc A,3117,F00000XLVH,0P00018IVC,,,,
Everbright Pramerica Jixin Alloc C,3118,F00000XLVI,0P00018IVD,,,,
Everbright Pramerica Medium-High Gd Bd A,2405,F00000Z76E,0P0001B9AJ,,,,
Everbright Pramerica Medium-High Gd Bd C,2406,F00000Z76F,0P0001B9AK,,,,
Everbright Pramerica Mid&Sm Cap Stk,360012,F00000GWR6,0P0000NBXB,,,,
Everbright Pramerica MingXin Alloc A,2773,F00000XRJB,0P00018PL6,,,,
Everbright Pramerica MingXin Alloc C,2774,F00000XRJC,0P00018PL7,,,,
Everbright Pramerica Money Market Fd,360003,F0HKG05X6Z,0P00007KJP,,,,
Everbright Pramerica New Gr Stk,360006,F0HKG06YF3,0P00007KN2,,,,
Everbright Pramerica OBOR Theme mix,1463,F00000VWQA,0P000165ZU,,,,
Everbright Pramerica Quantified Core,360001,F0HKG05VS2,0P00007KI3,,,,
Everbright Pramerica Ruixin Alloc A,1939,F00000WJ6X,0P000170EU,,,,
Everbright Pramerica Ruixin Alloc C,2075,F00000WJ70,0P000170EX,,,,
Everbright Pramerica Shengli Bd A,5579,F000010PHM,0P0001DKU7,,,,
Everbright Pramerica Shengli Bd C,5580,F000010PHN,0P0001DKU8,,,,
Everbright Pramerica Silverhair Opps Eq,589,F00000T0Y2,0P00012HKY,,,,
Everbright Pramerica Suimo Div Pure Bd A,489,F00000TWPO,0P00013NSI,,,,
Everbright Pramerica Suimo Div Pure Bd C,490,F00000TWPP,0P00013NSJ,,,,
Everbright Pramerica Wheel Flex Alloc,2305,F00000WQ3E,0P000178CQ,,,,
Everbright Pramerica XianJin FWY Alloc,2472,F00000ZE8F,0P0001BHSM,,,,
Everbright Pramerica xinxin Alloc A,1903,F00000WIFJ,0P00016ZC0,,,,
Everbright Pramerica xinxin Alloc C,1904,F00000WIFK,0P00016ZC1,,,,
Everbright Pramerica Yao Wallet MMKt A,1973,F00000WHG6,0P00016XU4,,,,
Everbright Pramerica Yao Wallet MMKt B,3481,F00000YBYP,0P00019H7U,,,,
Everbright Pramerica Yongli Pure Bd A,3195,F00000YE64,0P00019K96,,,,
Everbright Pramerica Yongli Pure Bd C,3196,F00000YE65,0P00019K97,,,,
Everbright Pramerica Yongxin Alloc A,3105,F00000XLVJ,0P00018IVE,,,,
Everbright Pramerica Yongxin Alloc C,3106,F00000XLVK,0P00018IVF,,,,
Everbright State-owned Reform Theme Eq,1047,F00000VE03,0P00015FPX,,,,
First State Cinda Anyi Pure Bd,4838,F00000ZSYK,0P0001CAK8,,,,
First State Cinda Consumption Optimiz Eq,610007,F00000ON4O,0P0000WLU6,,,,
First State Cinda Credit Bond Fund A,610008,F00000PT19,0P0000YI7U,,,,
First State Cinda Credit Bond Fund C,610108,F00000PT1A,0P0000YI7V,,,,
First State Cinda CSI SHS Div Sel Index,5770,F00001109Q,0P0001EEQP,,,,
First State Cinda Dividend Return Equity,610005,F00000IRZI,0P0000OO3F,,,,
First State Cinda Essen Dyn Asset Alloc,610002,F00000221S,0P0000GEFO,,,,
First State Cinda Heat China Alloc,3291,F00000YZOB,0P0001AJ4G,,,,
First State Cinda Huiguanjia MMkt Fd A,681,F00000TNUY,0P00013BYA,,,,
First State Cinda Huiguanjia MMkt Fd C,682,F00000TNUZ,0P00013BYB,,,,
First State Cinda Huiguanjia MMkt Fd E,683,F00000TNV0,0P00013BYC,,,,
First State Cinda HuiWealth Managmet Fd,3171,F00000XNGD,0P00018KPR,,,,
First State Cinda Ids Upgrading Eq,610006,F00000MEIA,0P0000T2DB,,,,
First State Cinda Leaders Growth Eq Fd,610001,F0HKG06ZGH,0P000086BQ,,,,
First State Cinda New Energy Ind Stk Fd,1410,F00000VZ2T,0P0001696E,,,,
First State Cinda New Fortune Alloc Fd,3655,F00000Y48D,0P0001954F,,,,
First State Cinda New Target Alloc,3456,F00000XVNE,0P00018U0I,,,,
First State Cinda Pure Bond,2554,F00000X15G,0P00017OZO,,,,
First State Cinda Small-Mid Cap Equity,610004,F000004135,0P0000KYDQ,,,,
First State Cinda Stable Value Bond A,610003,F000002PDD,0P0000JS6F,,,,
First State Cinda Stable Value Bond B,610103,F000002PDE,0P0000JS6G,,,,
First State Cinda XinAn Bd(LOF),166105,F00000YCY3,0P00019ITQ,,,,
FirstState Cinda Restructure Innovate Eq,1105,F00000VH22,0P00015JL9,,,,
First-Trust Adv Gr Dyn Asset Allo Mixed,290005,F000001ZM1,0P0000G5S7,,,,
First-Trust Blue Chip Selected Stk Fd,290006,F000002SHX,0P0000K08E,,,,
First-Trust China Securities 200 Idx Fd,290010,F00000MDZ1,0P0000T16Q,,,,
First-Trust Competitive Sel Flx Alloc,5535,F00000ZYTN,0P0001CHSB,,,,
First-Trust CSI RAFI Index Classified A,150094,F00000ON9H,0P0000WLZY,,,,
First-Trust CSI RAFI Index Classified B,150095,F00000ON9I,0P0000WLZZ,,,,
First-Trust CSI RAFI Index Classified Fd,162907,F00000ON9G,0P0000WLZX,,,,
First-Trust Cycle Return Bond Fd,290009,F00000LOPJ,0P0000S1A6,,,,
First-Trust Daily Income MMKt A,290001,F0HKG05VSW,0P00007KIQ,,,,
First-Trust Daily Income MMKt B,2234,F00000X75C,0P00018003,,,,
First-Trust Daily Income MMKt E,2235,F00000X75D,0P00018004,,,,
First-Trust Development Theme Stock Fd,290008,F00000LHX4,0P0000RQN4,,,,
First-Trust Double Int and Double Ret Bd,290003,F0HKG06U2V,0P00007KLU,,,,
First-Trust Goodquality Life Stock Fd,290004,F0HKG06Z3Y,0P00007ZZ7,,,,
First-Trust Industry Seld Allc A,290012,F00000W8YT,0P00016LXH,,,,
First-Trust Industry Seld Allc C,2583,F00000X5OH,0P00017X4N,,,,
First-Trust Int +The Alloc,1978,F00000X4Q3,0P00017V9U,,,,
First-Trust Leading Stategy Fd,290002,F0HKG05VSR,0P00007KIR,,,,
First-Trust Mid&Sma-cap Selected Stk,290011,F00000MVB2,0P0000U02T,,,,
First-Trust Modern Service Industr Fd,290014,F00000PBB5,0P0000XSUP,,,,
First-Trust Natnl Policy Mtv Alloc,1569,F00000W7IS,0P00016K4F,,,,
First-Trust Strengthen Income Bond Fd A,290007,F000003TOI,0P0000KGG9,,,,
First-Trust Strengthen Income Bond Fd C,291007,F000003TOJ,0P0000KGGA,,,,
First-Trust Xin Sel Alloc A,1970,F00000WQA3,0P000178UG,,,,
First-Trust Xin Sel Alloc C,2580,F00000X5OI,0P00017X4O,,,,
First-Trust XinLi Alloc A,4227,F00000YVEV,0P0001ABLS,,,,
First-Trust XinLi Alloc C,4228,F00000YVEW,0P0001ABLT,,,,
First-Trust ZhiXuan Grow Alloc,3333,F00000Y61D,0P000197H6,,,,
Fortune SG Baofeng High Grade Bd A,6300,F000010Z7B,0P0001EDF9,,,,
Fortune SG Baofeng High Grade Bd C,6301,F000010Z7C,0P0001EDFA,,,,
Fortune SG Baokang Consumption Fund,240001,F0HKG05VRP,0P00007KGE,,,,
Fortune SG CSI 300 Val dx Enhance,3876,F00000Y7X8,0P000199RO,,,,
Fortune SG Green Theme Alloc,5728,F000010UBE,0P0001E1FB,,,,
Fortune SG HK China Small Idx(QDII-LOF)A,501021,F00000X8PY,0P00018220,,,,
Fortune SG New Chance mix(LOF) C,3144,F00000XKM3,0P00018H2Y,,,,
Fortune SG New Power Flxble Alloc,3154,F00000XNB5,0P00018KHB,,,,
Fortune SG S&P China A Bonus Idx (LOF) C,5125,F00000ZF6B,0P0001BIWS,,,,
Fortune SG S&P US Cosmt Eq (QDII-LOF)USD,2423,F00000WWGO,0P00017J8U,,,,
Fortune SG SP SHS Enh Value Idx(LOF),501310,F000010Z7D,0P0001EDFB,,,,
Fortune SG Value Discovery Alloc,5445,F00000ZW1F,0P0001CEFA,,,,
Fortune SG ZZ 500 Index Enhan A,5607,F00001080G,0P0001CU1V,,,,
Fortune SG ZZ 500 Index Enhan C,5608,F00001080H,0P0001CU1W,,,,
FORTUNE&ROYAL 1-3Y nation debt Pure Bd,6488,F000011811,0P0001ENGU,,,,
FORTUNE&ROYAL FuAn Alloc A,4790,F00000ZQIR,0P0001C6E2,,,,
FORTUNE&ROYAL FuAn Alloc C,4791,F00000ZQIS,0P0001C6E3,,,,
FORTUNE&ROYAL Fuan Bd A,5173,F00000ZYA7,0P0001CH4T,,,,
FORTUNE&ROYAL Fuan Bd C,5174,F00000ZYA8,0P0001CH4U,,,,
FORTUNE&ROYAL Fujin Alloc A,5164,F00000ZVC5,0P0001CDFD,,,,
FORTUNE&ROYAL Fujin Alloc C,5165,F00000ZVC6,0P0001CDFE,,,,
FORTUNE&ROYAL Fukang Alloc A,5104,F00000ZU40,0P0001CBVE,,,,
FORTUNE&ROYAL Fukang Alloc C,5105,F00000ZU41,0P0001CBVF,,,,
FORTUNE&ROYAL FuQian Bd A,4792,F00000ZQIP,0P0001C6E0,,,,
FORTUNE&ROYAL FuQian Bd C,4793,F00000ZQIQ,0P0001C6E1,,,,
FORTUNE&ROYAL FuTai Alloc A,4788,F00000ZQIN,0P0001C6DY,,,,
FORTUNE&ROYAL FuTai Alloc C,4789,F00000ZQIO,0P0001C6DZ,,,,
FORTUNE&ROYAL FuXiang Pure Bd,3999,F00000YN0S,0P00019VTR,,,,
FORTUNE&ROYAL Fuxin Alloc A,4794,F00000ZPMC,0P0001C2M6,,,,
FORTUNE&ROYAL Fuxin Alloc C,4795,F00000ZPMD,0P0001C2M7,,,,
FORTUNE&ROYAL FuXing Pure Bd,4441,F00000YN0R,0P00019VTQ,,,,
FORTUNE&ROYAL MMkt A,3467,F00000Y789,0P000198XV,,,,
FORTUNE&ROYAL MMkt B,3468,F00000Y78A,0P000198XW,,,,
FORTUNE&ROYAL Value Sele Alloc A,6109,F000010PCN,0P0001DKNH,,,,
FORTUNE&ROYAL Value Sele Alloc C,6110,F000010PCO,0P0001DKNI,,,,
FortuneSG HK China Small Idx (QDII-LOF)C,6127,F000010TZ4,0P0001E0ZE,,,,
Founder Fubon CSI Ensurance Idx A,150329,F00000VZD2,0P000169I8,,,,
Founder Fubon CSI Ensurance Idx B,150330,F00000VZD3,0P000169I9,,,,
Founder Fubon CSI Insurance Idx,167301,F00000VZD1,0P000169I7,,,,
Founder Fubon Dividend Selected Stk Fd,730002,F00000OYZW,0P0000X9GP,,,,
Founder Fubon HuiLi Pure Bd A,3787,F00000Y9B4,0P00019CLF,,,,
Founder Fubon HuiLi Pure Bd C,3788,F00000Y9B5,0P00019CLG,,,,
Founder Fubon Innovation Power Bond Fd,730001,F00000NDJE,0P0000UQV7,,,,
Founder Fubon Jinxiaobao Money Market Fd,797,F00000UDQV,0P000147EB,,,,
Founder Fubon Money Market Fund A,730003,F00000P8QW,0P0000XPD7,,,,
Founder Fubon Money Market Fund B,730103,F00000P8QX,0P0000XPD8,,,,
Founder Fubon RuiLi Pure Bd A,3795,F00000Y8J4,0P00019B3A,,,,
Founder Fubon RuiLi Pure Bd C,3796,F00000Y8J5,0P00019B3B,,,,
Franklin Templeton Sealand China Inc Fd,450001,F0HKG05XQY,0P00007KJT,,,,
Franklin Templeton Sealand Enh Inc Bd A,450005,F0000026UB,0P0000I3GA,,,,
Franklin Templeton Sealand Enh Inc Bd C,450006,F000002JDW,0P0000J2LG,,,,
Franklin Templeton Sealand Flexi Cap Stk,450002,F0HKG06TPY,0P00007KLS,,,,
Franklin Templeton Sealand Gr Dyn Stk,450007,F000002OEL,0P0000JO8M,,,,
Franklin Templeton Sealand Rsrch Sel Stk,450011,F00000O46N,0P0000VVE6,,,,
FS China Prospect Mixed Assets A CNH,450003,F0HKG06ZJQ,0P000087U5,,,,
FTS AnXiang MMKt,4120,F00000YYMF,0P0001AH8I,,,,
FTS Asia (except Japan) Oppt Stk QDII Fd,457001,F00000NJCW,0P0000V0BF,,,,
FTS CSI 100 Enhanced Index Fd,164508,F00000VDSU,0P00015FHH,,,,
FTS CSI 100 Enhanced Index Fd A,150135,F00000VDSV,0P00015FHI,,,,
FTS CSI 100 Enhanced Index Fd B,150136,F00000VDSW,0P00015FHJ,,,,
FTS CSI 300 Index Strengthen Fd,450008,F000003Y4N,0P0000KSE2,,,,
FTS Daily Income Money Market Fund A,203,F00000Q4GV,0P0000Z393,,,,
FTS Daily Income Money Market Fund B,204,F00000Q4GW,0P0000Z394,,,,
FTS Deepening Value Stock Fd,450004,F000001ZV1,0P0000G71J,,,,
FTS Financial Property mix A,1392,F00000VV11,0P000163SG,,,,
FTS Financial Property mix C,1393,F00000VV12,0P000163SH,,,,
FTS Glob Tech Inter Alloc(QDII) USD,6374,F0000118ZS,0P0001EOTY,,,,
FTS Glob Tech Inter Alloc(QDII)CNY,6373,F0000118ZR,0P0001EOTT,,,,
FTS Great China Selec Balanced Fd QDII,934,F00000V699,0P000155HN,,,,
FTS Health High Lvl Life Eq,761,F00000U566,0P00013Y7W,,,,
FTS HengJiu Credit Bd A,450018,F00000ONFR,0P0000WM6H,,,,
FTS HengJiu Credit Bd C,450019,F00000ONFS,0P0000WM6I,,,,
FTS HengLi Bd(LOF)A,164509,F00000YO07,0P00019X5S,,,,
FTS HengLi Bd(LOF)C,164510,F00000YO08,0P00019X5T,,,,
FTS HengRui Bond Fund A,2361,F00000WSDV,0P00017BUG,,,,
FTS HengRui Bond Fund C,2362,F00000WSDW,0P00017BUH,,,,
FTS Hotspots Activt Flx-Cnfigr Bal,65,F00000PRLK,0P0000YF07,,,,
FTS Mid-Cap and Small-Cap Stock Fd,450009,F00000JWD8,0P0000Q3WN,,,,
FTS New Chance Alloc A,2087,F00000WIZU,0P00017066,,,,
FTS New Chance Alloc C,2088,F00000WIZV,0P00017067,,,,
FTS New Growth Alloc A,2092,F00000WJFB,0P000170O0,,,,
FTS New Growth Alloc C,2093,F00000WJFC,0P000170O1,,,,
FTS New Power Alloc Fd A,2099,F00000XMNI,0P00018JRK,,,,
FTS New Trend Flxbl Alloc A,5552,F00000ZYSN,0P0001CHRB,,,,
FTS New Trend Flxbl Alloc C,5553,F00000ZYSO,0P0001CHRC,,,,
FTS RiXin YueYing30-D Fincl Bd A,4663,F00000Z1AV,0P0001ALHN,,,,
FTS RiXin YueYing30-D Fincl Bd B,4664,F00000Z1AW,0P0001ALHO,,,,
FTS SHS Growth Selection Eq,1605,F00000WOOQ,0P000176Q4,,,,
FTS Strategy Ret Dyn Asset Allo Mixed Fd,450010,F00000MM91,0P0000TLEP,,,,
FTS Tianyi Alloc A,5652,F00001034N,0P0001CNLX,,,,
FTS Tianyi Alloc C,5653,F00001034O,0P0001CNLY,,,,
FTS Valuation Advanced Alloc,6039,F000010NA6,0P0001DI8P,,,,
FuAnDa Advantage Bond Fund A,710301,F00000OI9B,0P0000WF28,,,,
FuAnDa Advantage Bond Fund B,710302,F00000OI9C,0P0000WF29,,,,
Fuanda Advantage Growth Stock Fd,710001,F00000MRX6,0P0000TV8E,,,,
FuAnDa Changying Flxbl Alloc,2584,F000010IS2,0P0001DD1L,,,,
FuAnDa Consumer Theme Alloc,4549,F00000Z5I8,0P0001B6HO,,,,
FuAnDa Emerging Gr Alloc Fd,755,F00000U393,0P00013VQR,,,,
FuAnDa Emerging Power Alloc Fd,1659,F00000Y4FA,0P000195D8,,,,
FuAnDa Healthy Life Alloc,1861,F00000WHB5,0P00016XMP,,,,
FuAnDa Industry Wheel Moving Flx Alloc,1660,F0000106CQ,0P0001CS3Z,,,,
FuAnDa Money Market Fund A,710501,F00000PCP5,0P0000XUWD,,,,
FuAnDa Money Market Fund B,710502,F00000PCP6,0P0000XUWE,,,,
FuAnDa Strategy Select Balance Fund,710002,F00000NZ1B,0P0000VPGW,,,,
Fullgoa Value Advantage,2340,F00000WXNP,0P00017KSZ,,,,
Fullgoal Baoli Enhanced Bd,5078,F00000ZZJA,0P0001CIND,,,,
Fullgoal Beautiful China Stock Fund,2593,F00000X3BG,0P00017T67,,,,
Fullgoal China Secs 500 Idx Strengthen,161017,F00000MU6P,0P0000TYLS,,,,
Fullgoal China Secs Bank Idx Fd,161029,F00000VNGY,0P00015RPM,,,,
Fullgoal China Secs Bank Idx Fd A,150241,F00000VNGZ,0P00015RPN,,,,
Fullgoal China Secs Bank Idx Fd B,150242,F00000VNH0,0P00015RPO,,,,
Fullgoal China Secs new energy vehicles,161028,F00000VF81,0P00015HK1,,,,
Fullgoal China Secs new energy vehicls A,150211,F00000VF7Z,0P00015HJZ,,,,
Fullgoal China Secs new energy vehicls B,150212,F00000VF80,0P00015HK0,,,,
Fullgoal China Small-Cap Stock Fd (QDII),100061,F00000ONZ1,0P0000WMSD,,,,
Fullgoal ChinaBd1-3Y CDB Bd A,6409,F00001153J,0P0001EKD8,,,,
Fullgoal ChinaBd1-3Y CDB Bd C,6410,F00001153K,0P0001EKD9,,,,
Fullgoal Consumption Theme Eq Fd,519915,F00000UPFH,0P00014MSN,,,,
Fullgoal Convertible Bond Fd,100051,F00000LHL1,0P0000RQ84,,,,
Fullgoal Country Development Equity Fd,471,F00000SCOQ,0P00011MXO,,,,
Fullgoal Credit Bond Fund A,191,F00000PYON,0P0000YVNK,,,,
Fullgoal Credit Bond Fund C,192,F00000PYOO,0P0000YVNL,,,,
Fullgoal CSI 1000 Index Fd LOF,161039,F000010F34,0P0001D6WT,,,,
Fullgoal CSI 300 Strengthen Fd,100038,F000005GWX,0P0000M7W1,,,,
Fullgoal CSI CMNet Index,161025,F00000U3DY,0P00013VWX,,,,
Fullgoal CSI CMNet Index A,150194,F00000U3DZ,0P00013VWY,,,,
Fullgoal CSI CMNet Index B,150195,F00000U3E0,0P00013VWZ,,,,
Fullgoal CSI Coal Index,161032,F00000VWLH,0P000165U3,,,,
Fullgoal CSI Coal Index A,150321,F00000VWLI,0P000165U4,,,,
Fullgoal CSI Coal Index B,150322,F00000VWLM,0P000165U8,,,,
Fullgoal CSI Entertain Theme Index (LOF),161036,F00000YGLJ,0P00019NHN,,,,
Fullgoal CSI Fully Index Secs Idx A,150223,F00000VFRV,0P00015I8N,,,,
Fullgoal CSI Fully Index Secs Idx B,150224,F00000VFRW,0P00015I8O,,,,
Fullgoal CSI Fully Index Secs Idx Fd,161027,F00000VFRU,0P00015I8M,,,,
Fullgoal CSI Gym Index,161030,F00000VW8E,0P000165BA,,,,
Fullgoal CSI Gym Index A,150307,F00000VW8F,0P000165BH,,,,
Fullgoal CSI Gym Index B,150308,F00000VW8G,0P000165C0,,,,
Fullgoal CSI High-end Manufa Index(LOF),161037,F00000YPVF,0P0001A0CN,,,,
Fullgoal CSI Industry 4.0 Index,161031,F00000VV0V,0P000163SA,,,,
Fullgoal CSI Industry 4.0 Index A,150315,F00000VV0W,0P000163SB,,,,
Fullgoal CSI Industry 4.0 Index B,150316,F00000VV0X,0P000163SC,,,,
Fullgoal CSI Medical thm Enhed Idx(LOF),161035,F00000XSBK,0P00018QIB,,,,
Fullgoal CSI Natl Enterprise Reform Idx,161026,F00000V1EH,0P00014Z51,,,,
Fullgoal CSI Natl Enterprise Reform IdxA,150209,F00000V1EI,0P00014Z52,,,,
Fullgoal CSI Natl Enterprise Reform IdxB,150210,F00000V1EJ,0P00014Z53,,,,
Fullgoal CSI Natnl Defense Ind Idx Fd,161024,F00000SXTG,0P00012DLK,,,,
Fullgoal CSI Natnl Defense Ind Idx Fd A,150181,F00000SXTH,0P00012DLL,,,,
Fullgoal CSI Natnl Defense Ind Idx Fd B,150182,F00000SXTI,0P00012DLM,,,,
Fullgoal CSI Smart Car Index(LOF),161033,F00000WQ3D,0P000178CP,,,,
Fullgoal Cycle Advanced Fd,5760,F000010J54,0P0001DDH9,,,,
Fullgoal Defense Theme Alloc,5609,F0000105XF,0P0001CRFY,,,,
Fullgoal DingLi Pure Bd,4736,F00000Z4LG,0P0001B2SK,,,,
Fullgoal Emerging Industry Stock Fd,1048,F00000VC8F,0P00015DAY,,,,
Fullgoal Enhance Bond Fund A/B,100035,F000002YOH,0P0000K9YQ,,,,
Fullgoal Enhance Bond Fund C,100037,F000002YOI,0P0000K9YR,,,,
Fullgoal Exclusive Manufature Eq,513,F00000TGW4,0P00013452,,,,
Fullgoal FengLi ZengQiang Bd,4902,F00000ZC4D,0P0001BEWK,,,,
Fullgoal Glbl Tech Internet Eq QDII,100055,F00000MJFN,0P0000THMO,,,,
Fullgoal Global Bond Fd QDII,100050,F00000JR64,0P0000PVB2,,,,
Fullgoal Growth Enterp Mkt Clasifi Fd,161022,F00000Q9V5,0P0000Z9U1,,,,
Fullgoal Growth Enterp Mkt Clasifi Fd A,150152,F00000Q9V6,0P0000Z9U2,,,,
Fullgoal Growth Enterp Mkt Clasifi Fd B,150153,F00000Q9V7,0P0000Z9U3,,,,
Fullgoal Health Care Industry Equity Fd,220,F00000Q49F,0P0000Z30Q,,,,
Fullgoal High-Tech Industrial Stock Fund,100060,F00000OBJK,0P0000W9KB,,,,
Fullgoal HK Lianghua Sele Eq,5707,F000010EA5,0P0001D5UL,,,,
Fullgoal HongLi Pure Bd,4920,F00000ZAIY,0P0001BD02,,,,
Fullgoal Income Enhanced Bond A,810,F00000UFYK,0P000149XT,,,,
Fullgoal Income Enhanced Bond C,812,F00000UFYL,0P000149XU,,,,
Fullgoal Income Plus Exchanged MMkt A,1981,F00000WI4O,0P00016YVO,,STUSA05KOH,,
Fullgoal Income Plus Exchanged MMkt B,1982,F00000WI4P,0P00016YVP,,STUSA05KOH,,
Fullgoal Income Plus Exchanged MMkt H,511900,F00000WI4Q,0P00016YVQ,,STUSA05KOH,,
Fullgoal Income Plus MMkt Fund,602,F00000TGHF,0P000133OG,,,,
Fullgoal Industry Bond Bond Fd,100058,F00000NBFO,0P0000UJ7Q,,,,
Fullgoal Industry Motiv Alloc,5840,F000011812,0P0001ENGV,,,,
Fullgoal Infl&Defl Them Wheel Moving Stk,100039,F00000H334,0P0000NN23,,,,
Fullgoal Innovtin Tecnlgy Alloc,2692,F00000X802,0P0001818I,,,,
Fullgoal JingLi Pure Bd,5171,F00000ZORE,0P0001BW1U,,,,
Fullgoal JiuLi Stable Alloc A,3877,F00000Y6ZX,0P000198PD,,,,
Fullgoal JiuLi Stable Alloc C,3878,F00000Y6ZY,0P000198PE,,,,
Fullgoal Large Cap Value LH Sele Alloc,6022,F000010MGT,0P0001DH7W,,,,
Fullgoal Literary Healthy Eq,1186,F00000VOBV,0P00015SXL,,,,
Fullgoal Low Carbon Envir Protection Stk,100056,F00000MMYU,0P0000TNBX,,,,
Fullgoal Low Carbon New Economy mix,1985,F00000WJ7C,0P000170F9,,,,
Fullgoal Marco Strat Flex-Configr Bal Fd,29,F00000PKTR,0P0000Y509,,,,
Fullgoal Mid&Sm Cap Select Alloc Fd,940,F00000V566,0P00015460,,,,
Fullgoal New Chance Flxbl Alloc A,4674,F00000ZO4A,0P0001BV7M,,,,
Fullgoal New Chance Flxbl Alloc C,4675,F00000ZO4B,0P0001BV7N,,,,
Fullgoal New Grow Sele Alloc(LOF),161038,F00000Z046,0P0001AJYJ,,,,
Fullgoal New HuoLi Alloc A,4604,F00000YVZ4,0P0001ACCX,,,,
Fullgoal New HuoLi Alloc C,4605,F00000YVZ5,0P0001ACCY,,,,
Fullgoal New Income mix A,1345,F00000VT9N,0P000161GJ,,,,
Fullgoal New Income mix C,1347,F00000VT9O,0P000161GK,,,,
Fullgoal New Power Alloc A,1508,F00000W06W,0P00016AJH,,,,
Fullgoal New Power Alloc C,1510,F00000W06X,0P00016AJI,,,,
Fullgoal New Return Flexible Fd A/B,841,F00000UM6B,0P00014IAX,,,,
Fullgoal New Return Flexible Fd C,843,F00000UM6D,0P00014IAZ,,,,
Fullgoal New Trend Flxbl Alloc A,5517,F000010276,0P0001CMH2,,,,
Fullgoal New Trend Flxbl Alloc C,5518,F000010277,0P0001CMH3,,,,
Fullgoal New YouXiang Alooc A,4737,F00000Z6OV,0P0001B8CO,,,,
Fullgoal New YouXiang Alooc C,4747,F00000Z6OW,0P0001B8CP,,,,
Fullgoal Prn mdc Alloc,5176,F00000ZLLZ,0P0001BS6M,,,,
Fullgoal Pure Bond Fund A/B,100066,F00000OXSS,0P0000X7PP,,,,
Fullgoal Pure Bond Fund C,100068,F00000OXST,0P0000X7PQ,,,,
Fullgoal Reform Power Alloc,1349,F00000VT1E,0P0001617N,,,,
Fullgoal Seletion SHS Feile Alloc Fd,1827,F00000WRPI,0P00017B3H,,,,
Fullgoal SHS Ind Sele Alloc,5354,F00000ZR7U,0P0001C8K6,,,,
Fullgoal SHS Value Select mix,1371,F00000VV0Y,0P000163SD,,,,
Fullgoal SHS Yeji Qudong Alloc,5847,F000010QFE,0P0001DWLX,,,,
Fullgoal SSE Composite Index ETF Feeder,100053,F00000LOLJ,0P0000S0NW,,,,
Fullgoal State Security Thematic,1268,F00000VSAY,0P00016072,,,,
Fullgoal State-owned Enterprise Bd A/B,139,F00000QCEH,0P0000ZD5K,,,,
Fullgoal State-owned Enterprise Bd C,141,F00000QCEI,0P0000ZD5L,,,,
Fullgoal State-owned Reform Flxbl Alloc,5357,F00000ZXRB,0P0001CGJL,,,,
Fullgoal Steadiness Enhanced Bd A/B,107,F00000WRRO,0P00017B5U,,,,
Fullgoal Steadiness Enhanced Bd C,109,F00000WRX0,0P00017BB7,,,,
Fullgoal Study Select Flexible Alloc Fd,880,F00000UP1R,0P00014M5D,,,,
Fullgoal Tianbo Innovation Theme Stk Fd,519035,F0HKG070NR,0P00009DG6,,,,
Fullgoal Tiancheng Div Dyn Asset Alloc,100029,F000001W9D,0P0000FYC6,,,,
Fullgoal Tianding China Sec Div Idx Stre,100032,F000002A62,0P0000INWH,,,,
Fullgoal Tianfeng Strengthen Inc Bd(LOF),161010,F00000NA1L,0P0000UH32,,,,
Fullgoal Tianhe Stable Selected Stk Fd,100026,F0HKG06YYN,0P00007KNG,,,,
Fullgoal Tianhui Selected Growth Mixed A,161005,F0HKG064PU,0P00007KKF,,,,
Fullgoal Tianhui Selected Growth Mixed C,3494,F00000YQ51,0P0001A10R,,,,
Fullgoal Tianli Growth Bond Fd,100018,F0HKG05VPC,0P00007KJ0,,,,
Fullgoal Tianrui Surging Area Sel Mixed,100022,F0HKG05VSL,0P00007KGY,,,,
Fullgoal Tiansheng Flexible Alloc Fd,634,F00000T90O,0P00012UGD,,,,
Fullgoal Tianshi Money Market Fd A,100025,F0HKG06TP4,0P00007KLR,,,,
Fullgoal Tianshi Money Market Fd B,100028,F0HKG06Z5N,0P00007YIH,,,,
Fullgoal Tianshi Money Market Fd C,862,F00000UQKU,0P00014O45,,,,
Fullgoal Tianshi Money Market Fd D,863,F00000UQMC,0P00014O5N,,,,
Fullgoal Tianyi Value Stock Fd,100020,F0HKG05VPK,0P00007KIH,,,,
Fullgoal Tianying Bond (LOF),161015,F00000TGW7,0P00013455,,,,
Fullgoal Tianyuan SHS Balanced Mixed,100016,F00000WGWB,0P00016X2S,,,,
Fullgoal Trs Bd,6134,F0000112PO,0P0001EHOP,,,,
Fullgoal Upgrade Industries Alloc,4183,F00000YX6T,0P0001AEUM,,,,
Fullgoal value Driven Flx Alloc A,5472,F000010473,0P0001CP5Q,,,,
Fullgoal value Driven Flx Alloc C,5473,F000010474,0P0001CP5R,,,,
Fullgoal Wallet Full Money Market Fd,638,F00000T90G,0P00012UG5,,,,
Fullgoal XingLi ZengQiang Bd,5121,F00000ZFTN,0P0001BJPU,,,,
Fullgoal Xinwang Sus Pnsn 1-Y Alloc(FOF),6297,F000011EPD,0P0001EW9Q,,,,
Fullgoal YanJiu LiangHua Select Alloc,5075,F00000ZGNS,0P0001BKQH,,,,
Fullgoal Yili Pure Bd,5920,F000010W3L,0P0001E52Q,,,,
Fullgoal Zhenxuan Growth Alloc,5732,F000010S7F,0P0001DYSE,,,,
Fullgoal Zhuanxing Chan Alloc,5739,F0000109PK,0P0001CXPR,,,,
Galaxy Beautiful Youcui Eq A,519664,F00000T8CN,0P00012TC3,,,,
Galaxy Beautiful Youcui Eq C,519665,F00000T8CO,0P00012TC4,,,,
Galaxy BenLi Alloc A,519649,F00000YK1B,0P00019SGJ,,,,
Galaxy BenLi Alloc C,519650,F00000YK1C,0P00019SGK,,,,
Galaxy Blue Chip Selected Stock Fd,519672,F00000IR7O,0P0000OMSN,,,,
Galaxy Competitive Advantage Gr Stk Fd,519668,F000001W5D,0P0000FXZJ,,,,
Galaxy Consumption Driving Stock Fd,519678,F00000MK8A,0P0000TIZT,,,,
Galaxy CSI 300 Value Index Fd,519671,F000005HAC,0P0000MLGQ,,,,
