name,CSDCCCode,SecId,PerformanceId,MasterPortfolioId,ISIN,obsoletedate,obsoletetype
BOCOM Schroders HengYi Alloc,4975,F00000ZDN0,0P0001BGWD,,,,
BOCOM Schroders Huoqitong MMkt Fd A,3042,F00000XIF3,0P00018DDQ,,,,
BOCOM Schroders Huoqitong MMkt Fd E,3043,F00000XIF8,0P00018DDV,,,,
BOCOM Schroders Innovation Growth Alloc,6223,F000010VX5,0P0001E4UW,,,,
BOCOM Schroders Leading Return mix,519781,F00000XO3D,0P00018LF0,,,,
BOCOM Schroders LuoDe TianYunBao MMKR A,5002,F00000ZG8D,0P0001BK7S,,,,
BOCOM Schroders LuoDe TianYunBao MMKR E,5003,F00000ZG8E,0P0001BK7T,,,,
BOCOM Schroders Medical Innovation Eq,4075,F00000YJEA,0P00019RNV,,,,
BOCOM Schroders Money Market Fund A,519588,F0HKG06E10,0P00007KKO,,,,
BOCOM Schroders Money Market Fund B,519589,F0HKG0717Y,0P00009CZY,,,,
BOCOM Schroders Multi-stray Ret mix A,519755,F00000VUCB,0P000162QU,,,,
BOCOM Schroders Multi-stray Ret mix C,519761,F00000WJP0,0P000170Z1,,,,
BOCOM Schroders New Life Allco,519772,F00000XSBI,0P00018QI9,,,,
BOCOM Schroders New Return Mix A,519752,F00000VS62,0P00015ZJ0,,,,
BOCOM Schroders New Return Mix C,519760,F00000WJP1,0P000170Z2,,,,
BOCOM Schroders Pure Bond Fund A/B,519718,F00000P40V,0P0000XIBC,,,,
BOCOM Schroders Pure Bond Fund C,519720,F00000P40W,0P0000XIBD,,,,
BOCOM Schroders Qual Upgrade Alloc,5004,F00000ZYEH,0P0001CH9B,,,,
BOCOM Schroders Rongxiang Princ Gtd Bal,519726,F00000POH5,0P0000YABK,,,,
BOCOM Schroders Rongxin Grt mix,519766,F00000WZ6I,0P00017MMG,,,,
BOCOM Schroders Rotation Bond Fund A/B,519723,F00000PN4P,0P0000Y7X0,,,,
BOCOM Schroders Rotation Bond Fund C,519725,F00000PN4Q,0P0000Y7X1,,,,
BOCOM Schroders SHS Value Select mix,519779,F00000XP46,0P00018MQA,,,,
BOCOM Schroders State-owned Ref mix,519756,F00000VU05,0P000162B0,,,,
BOCOM Schroders Strategy Return Alloc,519710,F00000VY97,0P0001680L,,,,
BOCOM Schroders Tech Creative Alloc,519767,F00000X283,0P00017QXH,,,,
BOCOM Schroders TianLi Box MMkt Fd A,2889,F00000XPWN,0P00018NL6,,,,
BOCOM Schroders TianLi Box MMkt Fd E,2890,F00000XPWO,0P00018NL7,,,,
BOCOM Schroders TianXin Box MMkt Fd A,3482,F00000Y7D7,0P00019939,,,,
BOCOM Schroders TianXin Box MMkt Fd E,3483,F00000Y7D8,0P0001993A,,,,
BOCOM Schroders TianYi Box MMkt Fd A,3968,F00000YBRI,0P00019GVM,,,,
BOCOM Schroders TianYi Box MMkt Fd E,3969,F00000YBRJ,0P00019GVN,,,,
BOCOM Schroders YuLi Pure Bd A,519786,F00000Y50I,0P0001967Q,,,,
BOCOM Schroders YuLi Pure Bd C,519787,F00000Y50J,0P0001967R,,,,
BOCOM Schroders YuLong Pure Bond A,519782,F00000Y6IG,0P0001981M,,,,
BOCOM Schroders YuLong Pure Bond C,519783,F00000Y6IH,0P0001981N,,,,
BOCOM Schroders Yuru Pure Bd A,5972,F000010IHI,0P0001DCPX,,,,
BOCOM Schroders Yuru Pure Bd C,5973,F000010IHJ,0P0001DCPY,,,,
BOCOM Schroders YuTong Pure Bond A,519762,F00000WN9J,0P0001755U,,,,
BOCOM Schroders YuTong Pure Bond C,519763,F00000WN9K,0P0001755V,,,,
BOCOM Schroders Yuxiang Pure Bd A,6367,F0000113AZ,0P0001EID2,,,,
BOCOM Schroders Yuxiang Pure Bd C,6368,F0000113B0,0P0001EID3,,,,
BOCOM Schroders YuYing Pure Bd A,519776,F00000XXRX,0P00018X65,,,,
BOCOM Schroders YuYing Pure Bd C,519777,F00000XXRY,0P00018X66,,,,
BOCOM Schroders ZengLi Str Bd A,4427,F00000YU69,0P0001A99B,,,,
BOCOM Schroders ZengLi Str Bd C,4428,F00000YU6A,0P0001A99C,,,,
BOCOMSchroders ChiXu CZ Them Alloc,5001,F00000ZQA8,0P0001C5ZW,,,,
BOCS CNI New Energy Index,164905,F00000VEP9,0P00015GVA,,,,
BOCS CNI New Energy Index A,150217,F00000VEPA,0P00015GVB,,,,
BOCS CNI New Energy Index B,150218,F00000VEPB,0P00015GVC,,,,
BoHai HuiJin HuiTianJin MMKT A,4786,F00000Z6OX,0P0001B8CQ,,,,
BoHai HuiJin HuiTianJin MMKT B,4787,F00000Z6OY,0P0001B8CR,,,,
BoHai HuiJin Quantity Huiying Flex Alloc,5021,F000010I6W,0P0001DCCO,,,,
BoHai HuiJin Ruixuan Alloc A,5429,F00000ZY0K,0P0001CGUB,,,,
BoHai HuiJin Ruixuan Alloc C,5430,F00000ZY0L,0P0001CGUC,,,,
Bosera Anti-inflation Strength Ret QDII,50020,F00000M8I4,0P0000SOH1,,,,
Bosera Asian Bond Fund QDII RMB,50030,F00000PCPB,0P0000XUWJ,,,,
Bosera Asian Bond Fund QDII USD Cash,50203,F00000PE4X,0P0000XWBR,,,,
Bosera Asian Bond Fund QDII USD Exchange,50202,F00000PCPC,0P0000XUWK,,,,
Bosera Balanced Allocation Mixed,50007,F0HKG06W4V,0P00007KLX,,,,
Bosera Cash Income Fd A,50003,F0HKG05VTF,0P00007KHA,,,,
Bosera Cash Income Fd B,665,F00000TIGJ,0P0001362L,,,,
Bosera Cash Money Market Fd A,730,F00000UE54,0P000147WF,,,,
Bosera Cash Money Market Fd B,891,F00000UQU5,0P00014OAR,,,,
Bosera Cash Money Market Fd C,2855,F00000XAHY,0P0001846W,,,,
Bosera Convert Strengthen Bond Fd A,50019,F00000JXZS,0P0000Q5ZF,,,,
Bosera Convertible Bond Enhanced Fund C,50119,F00000JXZT,0P0000Q5ZG,,,,
Bosera Credit Core Bond A,50027,F00000ONFV,0P0000WM6L,,,,
Bosera Credit Core Bond C,1661,F00000WBCZ,0P00016OWM,,,,
Bosera Credit Market Bond A/B,50011,F000002YOO,0P0000K9YX,,,,
Bosera Credit Market Bond C,50111,F000002YOV,0P0000K9Z4,,,,
Bosera CSI 500 Index Enhanc Fd A,5062,F00000ZEPZ,0P0001BIB7,,,,
Bosera CSI 500 Index Enhanc Fd C,5795,F000010AA2,0P0001CZE2,,,,
Bosera CSI 800 Ensurance Index A,150225,F00000VPOA,0P00015VWW,,,,
Bosera CSI 800 Ensurance Index B,150226,F00000VPOB,0P00015VWX,,,,
Bosera CSI 800 Ensurance Index Fund,160516,F00000VPO2,0P00015VS0,,,,
Bosera CSI Bank Index,160517,F00000VU06,0P000162B1,,,,
Bosera CSI Bank Index A,150267,F00000VU07,0P000162B2,,,,
Bosera CSI Bank Index B,150268,F00000VU08,0P000162B3,,,,
Bosera CSI Gold Wash Large 100 Idx A,1242,F00000VPO0,0P00015VRY,,,,
Bosera CSI Gold Wash Large 100 Idx I,1243,F00000VPO9,0P00015VWD,,,,
Bosera Culture Leisure Alloc,2424,F00000YP4S,0P00019ZC8,,,,
Bosera Domestic Demand Income Balance Fd,264,F00000Q5HL,0P0000Z4DK,,,,
Bosera Emerging Growth Fund,50009,F0HKG07181,0P00009DBF,,,,
Bosera Excellent Brand Stock Fund(LOF),160512,F00000MCH7,0P0000SVXI,,,,
Bosera FengQing Pure Bd,4689,F00000YZ0P,0P0001AHRF,,,,
Bosera FuCheng Pure Bd,3866,F00000YNSV,0P00019WX0,,,,
Bosera FuFa Pure Bd,3207,F00000XMNE,0P00018JRG,,,,
Bosera FuHe Pure Bd,4479,F00000Z047,0P0001AJYK,,,,
Bosera FuHua Pure Bond,3730,F00000Y5RK,0P0001975B,,,,
Bosera Fujia Pure Bd,4168,F00000YETG,0P00019L2E,,,,
Bosera FuNing Pure Bond,3162,F00000XKXH,0P00018HJW,,,,
Bosera FuRui Pure Bond,4200,F00000YCVI,0P00019IR1,,,,
Bosera FuShi China A Share Index,5183,F00000ZG8C,0P0001BK7R,,,,
Bosera FuTeng Pure Bd,4601,F00000YVYX,0P0001ACCQ,,,,
Bosera FuXiang Pure Bond,3258,F00000XZIH,0P00018ZT8,,,,
Bosera FuXin Pure Bond,3703,F00000Y4F8,0P000195D6,,,,
Bosera FuYi Pure Bond,3607,F00000XXUT,0P00018X9P,,,,
Bosera FuYuan Pure Bd,4307,F00000YHRO,0P00019P4B,,,,
Bosera Golden ETF Fdr A,2610,F00000X2GI,0P00017RK8,,,,
Bosera Golden ETF Fdr C,2611,F00000X2GJ,0P00017RK9,,,,
Bosera Greater CHN Asia-Pac Sel QDII USD,927,F00000V2DL,0P000150I9,,,,
Bosera Greater CHN Asia-Pac Sel Stk QDII,50015,F00000ISPZ,0P0000OP9O,,,,
Bosera HeFeng MMKT A,5195,F00000ZGNT,0P0001BKQI,,,,
Bosera HeFeng MMKT B,5196,F00000ZGNU,0P0001BKQJ,,,,
Bosera HeHui Money Market A,4841,F00000Z546,0P0001B5C1,,,,
Bosera HeHui Money Market B,4137,F00000YBGG,0P00019GE5,,,,
Bosera HeJun MMKT,4985,F00000ZAZM,0P0001BDHT,,,,
Bosera HeLi Money Market Fd,2960,F00000XJGR,0P00018EIJ,,,,
Bosera HeXin Money Market Fd,3206,F00000XRJO,0P00018PLJ,,,,
Bosera Houze Return Alloc A,5265,F00000ZN0A,0P0001BTZH,,,,
Bosera Houze Return Alloc C,5266,F00000ZN0B,0P0001BTZI,,,,
Bosera HuaYing Pure Bd,4458,F00000YMPY,0P00019VHP,,,,
Bosera HuiXiang Pure Bd A,4366,F00000YIVJ,0P00019QPP,,,,
Bosera HuiXiang Pure Bd C,4367,F00000YIVK,0P00019QPQ,,,,
Bosera HuiZhi Return Alloc,4448,F00000YN0U,0P00019VTT,,,,
Bosera Industry 4.0 Theme Eq,2595,F00000X3WM,0P00017U0U,,,,
Bosera Industry New Drive Alloc Fd A,936,F00000V6QU,0P0001560K,,,,
Bosera Industry New Drive Alloc Fd C,5878,F000010DCC,0P0001D4O3,,,,
Bosera Industry Wheel Moving Stock Fd,50018,F00000JVIQ,0P0000Q2U2,,,,
Bosera Innovation Driven Flxbl Alloc A,5482,F00000ZXX1,0P0001CGPS,,,,
Bosera Innovation Driven Flxbl Alloc C,5483,F00000ZXX2,0P0001CGPT,,,,
Bosera Internet Theme Flexible Alloc Fd,1125,F00000VIXP,0P00015MLG,,,,
Bosera JingFa Pure Bd,3023,F00000XJ36,0P00018E3S,,,,
Bosera Jingxing Pure Bd,2775,F00000X6T5,0P00017ZHF,,,,
Bosera Jingyuan Grt Mix A,2208,F00000WLB5,0P000172TV,,,,
Bosera Jingyuan Grt Mix C,2209,F00000WLB7,0P000172TX,,,,
Bosera JuLi Pure Bond,3259,F00000XO3E,0P00018LF1,,,,
Bosera Jungong Theme Eq,4698,F00000YZVG,0P0001AJHR,,,,
Bosera JuRun Pure Bond,2930,F00000XMXE,0P00018K1O,,,,
Bosera JuYing Pure Bond,2929,F00000XI77,0P00018D2M,,,,
Bosera JuYuan Pure Bd,3188,F00000YFSO,0P00019M6U,,,,
Bosera LiangHua Balan Alloc,4495,F00000YQJP,0P0001A1IO,,,,
Bosera LiFa Pure Bond,3260,F00000XNKI,0P00018KUB,,,,
Bosera Macro-Return Bond A/B,50016,F00000ITE6,0P0000OQ3W,,,,
Bosera Marco Total Return Fund C,50116,F00000ITE8,0P0000OQ3Y,,,,
Bosera Margin Timely Exchanged MMkt Fd,511860,F00000UPUC,0P00014N9G,,STUSA05KNE,,
Bosera Medical&Hlth Care Set Secs Invt A,50026,F00000OK2H,0P0000WH54,,,,
Bosera MingFeng Pure Bd A,3708,F00000Y77T,0P000198XF,,,,
Bosera MingFeng Pure Bd C,3709,F00000Y77V,0P000198XH,,,,
Bosera MingZe Pure Bd,4136,F00000YBG8,0P00019GDX,,,,
Bosera New Consumption Them Alloc,4505,F00000YP4T,0P00019ZC9,,,,
Bosera New Income Flexible Alloc Fd A,2095,F00000WJF5,0P000170NU,,,,
Bosera New Income Flexible Alloc Fd C,2096,F00000WJFA,0P000170NZ,,,,
Bosera New Start mix A,1424,F00000VXUP,0P000167LE,,,,
Bosera New Start mix C,1425,F00000VXUQ,0P000167LF,,,,
Bosera New Strategy mix A,1522,F00000W1E4,0P00016C38,,,,
Bosera New Strategy mix C,1523,F00000W1E5,0P00016C39,,,,
Bosera New Value Alloc A,2104,F00000WXUY,0P00017L15,,,,
Bosera New Value Alloc C,2105,F00000WXUZ,0P00017L16,,,,
Bosera Quantified Mul-Str Eq A,5635,F00001064Y,0P0001CROF,,,,
Bosera Quantified Mul-Str Eq C,5636,F00001064Z,0P0001CROG,,,,
Bosera Quantified Value Eq A,5960,F000010HKV,0P0001DBFQ,,,,
Bosera Quantified Value Eq C,5961,F000010HKW,0P0001DBFR,,,,
Bosera Return Dynamic Asset Alloc Mixed,50022,F00000MT9L,0P0000TXJW,,,,
Bosera Reverse Investment Bal A,4434,F00000YNNE,0P00019WPU,,,,
Bosera Reverse Investment Bal C,4435,F00000YNNF,0P00019WPV,,,,
Bosera RuiChu Pure Bond,3268,F00000XNWQ,0P00018L81,,,,
Bosera Ruili Event-driven Flx Alloc,160519,F00000ZU80,0P0001CBZR,,,,
Bosera RuiYi Event Driven Alloc LOF,160522,F0000105CW,0P0001CQTS,,,,
Bosera RuiYuan Event Drive Alloc(LOF),160518,F00000ZMFU,0P0001BT56,,,,
Bosera S&P 500 ETF Feeder QDII A,50025,F00000O7LB,0P0000W3BO,,,,
Bosera S&P 500 ETF Feeder QDII C,6075,F000010N5L,0P0001DI3P,,,,
Bosera Selection Stock Fd A,50004,F0HKG05VT0,0P00007KH2,,,,
Bosera SH Stk Exch Sup Lge-Cap ETF Fdr,50013,F000005IQI,0P0000MPHG,,,,
Bosera SHS Grt Enterprise Bal,1824,F00000XXRW,0P00018X64,,,,
Bosera SHS High-quality Corp Flexible A,1215,F00000VOZO,0P00015U3T,,,,
Bosera SHS High-quality Corp Flexible C,2555,F00000WZGV,0P00017MXH,,,,
Bosera SHS Value Selected mix A,4091,F00000Y95R,0P00019C5K,,,,
Bosera SHS Value Selected mix C,4092,F00000Y95S,0P00019C5L,,,,
Bosera Silu Theme Eq A,1236,F00000VR6H,0P00015Y9S,,,,
Bosera Silu Theme Eq C,2556,F00000WZGS,0P00017MXE,,,,
Bosera SOE Struct Reform ETF Fdr A,6438,F00001180X,0P0001ENGQ,,,,
Bosera SOE Struct Reform ETF Fdr C,6439,F00001180Y,0P0001ENGR,,,,
Bosera SSE 50 ETF Fdr A,1237,F00000VQVV,0P00015XQN,,,,
Bosera SSE 50 ETF Fdr C,5737,F00001081G,0P0001CU2W,,,,
Bosera SSE Natural Res Idx ETF Feeder Fd,50024,F00000NRWA,0P0000VH6W,,,,
Bosera Stable Return Bond (LOF) A,160513,F00000TIX5,0P000136M4,,,,
Bosera Stable Return Bond (LOF) C,160514,F00000TIX6,0P000136M5,,,,
Bosera Stable Value Bond Investment Fd B,50006,F0HKG060GO,0P00007KJY,,,,
Bosera Stable–Gain Bond Fund A,84,F00000PQ0Z,0P0000YCIN,,,,
Bosera Stable–Gain Bond Fund C,85,F00000PQ10,0P0000YCIO,,,,
Bosera State-owned Reform Theme Eq,1277,F00000VQO8,0P00015XD0,,,,
Bosera Strategy Dynamic Asset Alloc,50012,F000003WFR,0P0000KOUN,,,,
Bosera Stratgy New Indl Stk Fd,4677,F00000YYQV,0P0001AHER,,,,
Bosera Sustaining Value Bond Fd A,50106,F000000KPL,0P00009U25,,,,
Bosera SZSE Fundamental 200 ETF Fdr Fd,50021,F00000MD2A,0P0000SXP4,,,,
Bosera Tertiary Industry Growth Stk Fd,50008,F0HKG06ZPO,0P00008UM9,,,,
Bosera Theme Industry Stock Fd(LOF),160505,F0HKG05VTD,0P00007KES,,,,
Bosera Tiantian Inc MMkt A,734,F00000U21L,0P00013TLY,,,,
Bosera Tiantian Inc MMkt B,735,F00000U21M,0P00013TLZ,,,,
Bosera Tianyi Bond Fd A,50023,F00000NMHU,0P0000V437,,,,
Bosera TianYi Bond Fund C,50123,F00000NMHV,0P0000V438,,,,
Bosera Value Growth Fd,50001,F0HKG05VRU,0P00007KGH,,,,
Bosera Value Growth Fd 2,50201,F0HKG06YIQ,0P00007KN7,,,,
Bosera Value Mix Fund A,50010,F000001W7V,0P0000FY8D,,,,
Bosera Venture Growth Stock Fd A,50014,F00000H62S,0P0000NR3K,,,,
Bosera Venture Growth Stock Fd C,2553,F00000WZGT,0P00017MXF,,,,
Bosera Waiyan Gr Theme Flex Alloc,2142,F00000WPWP,0P0001785G,,,,
Bosera XinFeng Flxbl Alloc A,3436,F00000Y9AY,0P00019CL9,,,,
Bosera XinFeng Flxbl Alloc C,3437,F00000Y9AZ,0P00019CLA,,,,
Bosera XingRong MMKT Fd,4282,F00000YFSP,0P00019M6V,,,,
Bosera XinHui Flxbl Alloc A,4149,F00000YBR7,0P00019GVB,,,,
Bosera XinHui Flxbl Alloc C,4150,F00000YBR8,0P00019GVC,,,,
Bosera XinRui Flxbl Alloc A,2558,F00000XS17,0P00018Q71,,,,
Bosera XinRui Flxbl Alloc C,2559,F00000XS18,0P00018Q72,,,,
Bosera XinRun Flxbl Alloc A,3950,F00000Y7H2,0P0001997I,,,,
Bosera XinRun Flxbl Alloc C,3951,F00000Y7H3,0P0001997J,,,,
Bosera XinSheng MMTF,4060,F00000Y95V,0P00019C5O,,,,
Bosera XinTai Alloc A,4175,F00000YCJX,0P00019IDW,,,,
Bosera XinTai Alloc C,4176,F00000YCJY,0P00019IDX,,,,
Bosera XinYuan Flxbl Alloc A,3119,F00000XKXF,0P00018HJU,,,,
Bosera XinYuan Flxbl Alloc C,3120,F00000XKXG,0P00018HJV,,,,
Bosera XinZhe Flxbl Alloc A,3434,F00000XRQC,0P00018PVP,,,,
Bosera XinZhe Flxbl Alloc C,3435,F00000XRQD,0P00018PVQ,,,,
Bosera YinZhi Large data 100 Idx A,2588,F00000X1MR,0P00017PZD,,,,
Bosera YinZhi Large data 100 Idx C,4416,F00000ZHOA,0P0001BM3G,,,,
Bosera Yitai Alloc A,2813,F000010TM3,0P0001E0II,,,,
Bosera Yitai Alloc C,2814,F000010TM4,0P0001E0IJ,,,,
Bosera Yu Rong Pure Bd,1961,F00000WH4G,0P00016XE8,,,,
Bosera YuAn Pure Bd,2447,F00000WW2T,0P00017INP,,,,
Bosera YuAng Pure Bond,2970,F00000XG8Q,0P00018APQ,,,,
Bosera YuCheng Pure Bd,2140,F00000XWWG,0P00018VV0,,,,
Bosera YuChuang Pure Bond,2754,F00000X65V,0P00017YJW,,,,
Bosera YuDa Pure Bond Fd,2198,F00000WL0K,0P000172II,,,,
Bosera YuFa Bond Fd,2568,F00000WZGQ,0P00017MXC,,,,
Bosera Yuheng Pure Bd,1911,F00000WFG6,0P00016UY7,,,,
Bosera YuHong Pure Bond,2569,F00000XBBS,0P0001856D,,,,
Bosera YuJing Pure Bond,2519,F00000X3P9,0P00017TTA,,,,
Bosera Yukang Pure Bd,2206,F00000WL4E,0P000172MY,,,,
Bosera YuLi Pure Bond,2698,F00000X4PY,0P00017V9P,,,,
Bosera Yulong Flexible Alloc Fd,652,F00000TJHR,0P000137FC,,,,
Bosera YuPeng Pure Bd,4118,F00000YBG9,0P00019GDY,,,,
Bosera YuQian Pure Bond Fd A,2175,F00000WQQN,0P000179WC,,,,
Bosera YuQian Pure Bond Fd C,2404,F00000WTBK,0P00017CYM,,,,
Bosera YuQuan Pure Bd,2578,F00000XMND,0P00018JRF,,,,
Bosera YuRui Bond Fd,1578,F00000VZSD,0P00016A01,,,,
Bosera YuSheng Pure Bd,2755,F00000X6L9,0P00017Z49,,,,
Bosera YuShun Pure Bond,2811,F00000XBQF,0P000185M8,,,,
Bosera YuTai Pure Bond,1993,F00000WIG4,0P00016ZCK,,,,
Bosera YuTeng Pure Bond Fd,2354,F00000WQQM,0P000179WB,,,,
Bosera Yuxin Pure Bd,2466,F00000WXV0,0P00017L17,,,,
Bosera YuYi Flex-Configuration Bal Fund,219,F00000Q2R9,0P0000Z18R,,,,
Bosera Zhengjinbao MMkt,1308,F00000VWQS,0P0001660C,,,,
Bosera ZhenXuan Pure Bond,3566,F00000XXUL,0P00018X9H,,,,
Bosera ZhiZhen Pure Bd,3210,F00000XMNC,0P00018JRE,,,,
BoseraYufu CSI 300 Index Fund A,50002,F0HKG05VRD,0P00007KIO,,,,
BoseraYufu CSI 300 Index Fund C,2385,F00000WSE6,0P00017BUR,,,,
Broad Qihang Alloc A,6160,F000010SOX,0P0001DZCH,,,,
Broad Qihang Alloc C,6161,F000010SOY,0P0001DZCI,,,,
Broad Zhuoyuan Alloc A,6511,F000011AIZ,0P0001EQQD,,,,
Broad Zhuoyuan Alloc C,6512,F000011AJ0,0P0001EQQE,,,,
CaiTong CaiTongBao MMkt Fund A,2957,F00000XHZF,0P00018CTF,,,,
CaiTong CaiTongBao MMkt Fund B,2958,F00000XHZG,0P00018CTG,,,,
CaiTong ECPI ESG 100 Index Enhance Fd A,42,F00000PHTH,0P0000Y0TX,,,,
CaiTong ECPI ESG 100 Index Enhance Fd C,3184,F00000YU0Q,0P0001A90J,,,,
CaiTong Growth Sel mix,1480,F00000VWY2,0P00016687,,,,
CaiTong Huili Pure Bd,5854,F000010O5C,0P0001DJ93,,,,
CaiTong Income Enhanced Bd A,720003,F00000WPJA,0P000177R9,,,,
CaiTong Income Enhanced Bd C,3204,F00000YU0O,0P0001A90H,,,,
CaiTong Informtion positive income Bd A,2901,F00000XEAA,0P000188JW,,,,
CaiTong Informtion positive income Bd C,2902,F00000XEAB,0P000188JX,,,,
CaiTong Integrated circuit industry Eq A,6502,F000011DOP,0P0001EUWA,,,,
CaiTong Integrated circuit industry Eq C,6503,F000011DOQ,0P0001EUWB,,,,
CaiTong Juli Pure Bd,5853,F00001153I,0P0001EKD7,,,,
CaiTong Mul-Strategy Fuxiang Alloc (LOF),501026,F000010976,0P0001CX68,,,,
CaiTong Multi-Strategy Sel Bal(LOF),501001,F00000YDJF,0P00019JIR,,,,
CaiTong Multi-Strategy Stable Gr Bd Fd A,720002,F00000OCAS,0P0000WAIJ,,,,
CaiTong Multi-Strategy Stable Gr Bd Fd C,3205,F00000YU0N,0P0001A90G,,,,
CaiTong Multi-Strategy Upgrade Bal(LOF),501015,F00000ZH0G,0P0001BL4E,,,,
CaiTong New View Flxbl Alloc A,5851,F000010I0V,0P0001DC07,,,,
CaiTong New View Flxbl Alloc C,5959,F000010I0W,0P0001DC08,,,,
CaiTong Pure Bond A,497,F00000WRRR,0P00017B5X,,,,
CaiTong Pure Bond C,3542,F00000YU0P,0P0001A90I,,,,
CaiTong Quant Core Sele Alloc,6157,F000010VNZ,0P0001E4IZ,,,,
CaiTong Sustainable Dev Thematic Alloc,17,F00000PJML,0P0000Y35B,,,,
Caitong Value Momentum Mixed Fd,720001,F00000N9KG,0P0000UG6T,,,,
CaiTong XinRui Return Alloc A,4900,F00000ZGNO,0P0001BKQD,,,,
CaiTong XinRui Return Alloc C,4901,F00000ZGNP,0P0001BKQE,,,,
CaiTong XinYi Return Alloc A,4888,F00000ZAZG,0P0001BDHN,,,,
CaiTong XinYi Return Alloc C,4889,F00000ZAZH,0P0001BDHO,,,,
CaiTong ZG Consump Selection Alloc,5682,F0000105RC,0P0001CR9M,,,,
CaiTong ZG Hongyi Mid-sh Bd A,6360,F000010ZIQ,0P0001EDSR,,,,
CaiTong ZG Hongyi Mid-sh Bd C,6361,F000010ZIR,0P0001EDSS,,,,
CaiTong ZG Xinda Return Alloc A,5307,F00000ZSYN,0P0001CAKB,,,,
CaiTong ZG Xinda Return Alloc C,5308,F00000ZSYO,0P0001CAKC,,,,
CaiTong ZG Xinda Return Alloc E,5882,F000010QUC,0P0001DX2V,,,,
CaiTong ZGX Managed MMkt A,3479,F00000XWQM,0P00018V7E,,,,
CaiTong ZGX Managed MMkt B,3480,F00000XWQN,0P00018V7F,,,,
CCB Princ Dble Intr StraThem Classi Stk,165310,F00000MA3S,0P0000SR5I,,,,
CCB Principal 7-Day Bond Fd A,530030,F00000QEWP,0P0000ZGTL,,,,
CCB Principal 7-Day Bond Fd B,531030,F00000QEWQ,0P0000ZGTM,,,,
CCB Principal Cash Income MMF,2758,F00000XDWW,0P00018838,,,,
CCB Principal Cash Tianli Money Market A,693,F00000UDGR,0P0001471W,,,,
CCB Principal Cash Tianli Money Market B,3164,F00000XKSG,0P00018HA8,,,,
CCB Principal Cash TY Exchanged MMkt A,3022,F00000XLSD,0P00018IQ4,,STUSA05MIM,,
CCB Principal Cash TY Exchanged MMkt H,511660,F00000XLSE,0P00018IQ5,,STUSA05MIM,,
CCB Principal China CSI 300 Index Fd,165309,F0000043SK,0P0000L1N7,,,,
CCB Principal ChiNext ETF Fdr A,5873,F000010JCQ,0P0001DDPG,,,,
CCB Principal ChiNext ETF Fdr C,5874,F000010JCR,0P0001DDPH,,,,
CCB Principal Core Selected Stock Fd,530006,F0000029FJ,0P0000IN3B,,,,
CCB Principal Credit Enhanced Bd(LOF) A,165311,F00000TO0D,0P00013C4E,,,,
CCB Principal Credit Enhanced Bd(LOF) C,165314,F00000TO0E,0P00013C4F,,,,
CCB Principal CSI 500 Index Fd,478,F00000SD4U,0P00011NOM,,,,
CCB Principal CSI 500 Index Fd C,5633,F0000108L5,0P0001CWF5,,,,
CCB Principal Dual Income Bond Fund A,530017,F00000NCF2,0P0000UO4M,,,,
CCB Principal Dual Income Bond Fund C,531017,F00000U8SW,0P0001421N,,,,
CCB Principal Emerging Mkts Sel Stk QDII,539002,F00000MG8E,0P0000TDAS,,,,
CCB Principal Endogenous Gr Dynamic Stk,530011,F00000JWD9,0P0000Q3WO,,,,
CCB Principal Envirnmt Protect Ids Eq,1166,F00000VL3L,0P00015P0I,,,,
CCB Principal Exclusive Medical Eq,4683,F00000YZFG,0P0001AISQ,,,,
CCB Principal Factor Quant Eq,2952,F00000XH1I,0P00018BNG,,,,
CCB Principal FuZhe AT Alloc(FOF),5217,F00000ZJ2B,0P0001BOE3,,,,
CCB Principal Glbl Opportunity Stk QDII,539001,F00000JNHG,0P0000PO6K,,,,
CCB Principal Healthy Livelihood Bal Fd,547,F00000SQ9U,0P000123ZD,,,,
CCB Principal Hongli Flx Alloc,2378,F0000104CR,0P0001CPBJ,,,,
CCB Principal Huili Alloc Fd,2573,F000010GQV,0P0001D9ZI,,,,
CCB Principal Info Industry Eq,1070,F00000VE04,0P00015FPY,,,,
CCB Principal Jia Xinjinbao MMkt Fd A,686,F00000TOQU,0P00013DAE,,,,
CCB Principal Jia Xinjinbao MMkt Fd B,2753,F00000X6PB,0P00017ZBH,,,,
CCB Principal LH ShiJian QuDong Eq,4730,F00000ZC4B,0P0001BEWI,,,,
CCB Principal LongTou QiYe Eq,5259,F00000ZWXG,0P0001CFMR,,,,
CCB Principal Make In China 2025 Eq,1825,F00000YGET,0P00019N0J,,,,
CCB Principal Mdrn Srvie Industr Eq,1781,F00000WPL5,0P000177T4,,,,
CCB Principal Mid&Sml Cap Lead Eq,729,F00000TXNA,0P00013OUD,,,,
CCB Principal Money Market Fd A,530002,F0HKG06QYR,0P00007KLC,,,,
CCB Principal Money Market Fd B,3185,F00000XQSA,0P00018OLD,,,,
CCB Principal MSCI China A ETF Fdr A,5829,F000010CVB,0P0001D43O,,,,
CCB Principal MSCI China A ETF Fdr C,5830,F000010CVC,0P0001D43P,,,,
CCB Principal Net plus Ids Upg Eq,1396,F00000VVA5,0P00016458,,,,
CCB Principal New Economic Mix,1276,F00000VS5W,0P00015ZIQ,,,,
CCB Principal Optimizing Alloc Mixed Fd,530005,F0HKG06ZFY,0P000085UV,,,,
CCB Principal PF 1-3 Trs Bd Idx(LOF),501101,F00000YX0Y,0P0001AELL,,,,
CCB Principal PF 8-10 Trs Bd Idx(LOF),501105,F00000YX0X,0P0001AELK,,,,
CCB Principal Positive Allocation Bal Fd,530012,F00000SG45,0P00011RXR,,,,
CCB Principal Potential New Blue Chip Eq,756,F00000U3IR,0P00013W23,,,,
CCB Principal Precis manfctr,1397,F00000W0WX,0P00016BJQ,,,,
CCB Principal Reform Div Eq,592,F00000T4XU,0P00012NRY,,,,
CCB Principal Return Mix,1253,F00000VR6K,0P00015Y9V,,,,
CCB Principal RuiFeng TL Alloc A,3319,F00000XXNQ,0P00018X13,,,,
CCB Principal RuiFeng TL Alloc C,3320,F00000XXNR,0P00018X14,,,,
CCB Principal RuiFu Pure Bd,3590,F00000Y0M5,0P0001913X,,,,
CCB Principal RuiFu TianLi Alloc A,4182,F00000YVF1,0P0001ABLY,,,,
CCB Principal RuiFu TianLi Alloc C,4468,F00000YVF2,0P0001ABLZ,,,,
CCB Principal RuiXiang Pure Bd,3681,F00000Y48C,0P0001954E,,,,
CCB Principal Ruiying Flex Alloc Fd A,994,F00000V764,0P000156JJ,,,,
CCB Principal Ruiying Flex Alloc Fd C,995,F00000V765,0P000156JK,,,,
CCB Principal Security Strategy Sel Eq,1473,F00000VZJO,0P000169PX,,,,
CCB Principal Selected Gth Mixed Asset A,530003,F0HKG06YIO,0P00007KN1,,,,
CCB Principal Sino-Innovation Equity Fd,308,F00000QCPO,0P0000ZDIT,,,,
CCB Principal SSE Social Resp ETF Fdr,530010,F00000H5EB,0P0000NQ8V,,,,
CCB Principal Stable Fengli Bd A,1948,F00000WHGA,0P00016XU8,,,,
CCB Principal Stable Fengli Bd C,1949,F00000WHGB,0P00016XU9,,,,
CCB Principal Stable Income Bd A,875,F00000UP1V,0P00014M5H,,,,
CCB Principal Stable Income Bd C,876,F00000UP1W,0P00014M5I,,,,
CCB Principal Stable Value Mixed Fd,530016,F00000N9KE,0P0000UG6L,,,,
CCB Principal Stbl Return Flxbl Fd,1205,F00000VMUM,0P00015R11,,,,
CCB Principal Steady Growth Guarantee Fd,270,F00000Q88X,0P0000Z822,,,,
CCB Principal Strategic Select Alloc A,5596,F0000105RE,0P0001CR9O,,,,
CCB Principal Strategic Select Alloc C,5597,F0000105RF,0P0001CR9P,,,,
CCB Principal Sustain Enhanced Ret Bd A,435,F00000QSLO,0P000101H1,,,,
CCB Principal Sustain Enhanced Ret Bd C,723,F00000U8SX,0P0001421O,,,,
CCB Principal Sustain Proft Inc Stk Fd A,531008,F00000UH6S,0P00014BDD,,,,
CCB Principal Sustain Proft Inc Stk Fd C,530008,F000001ZM2,0P0000G5S8,,,,
CCB Principal SZSE Fdmtl 60 ETF Fdr A,530015,F00000MQTC,0P0000TSI3,,,,
CCB Principal SZSE Fdmtl 60 ETF Fdr C,6363,F0000111E4,0P0001EG9T,,,,
CCB Principal Unvarying Value Stock Fd,530001,F0HKG069PU,0P00007KKP,,,,
CCB Principal WDXinLi Bd A,3583,F00000YBG2,0P00019GDR,,,,
CCB Principal WDXinLi Bd C,3584,F00000YBG3,0P00019GDS,,,,
CCB Principal Xinan Mix,1304,F00000VS5X,0P00015ZIR,,,,
CCB Principal Xinfeng Return mix A,1408,F00000VWQT,0P0001660D,,,,
CCB Principal Xinfeng Return mix C,2141,F00000WJEP,0P000170NE,,,,
CCB Principal Xingli Alloc,2585,F000010O8V,0P0001DJCP,,,,
CCB Principal XinRong Mix,1498,F00000Y95J,0P00019C5C,,,,
CCB Principal XinRui Alloc,3831,F00000YF3R,0P00019LF8,,,,
CCB Principal XinWen Return Alloc A,4617,F00000ZMMK,0P0001BTEK,,,,
CCB Principal XinWen Return Alloc C,4618,F00000ZMML,0P0001BTEL,,,,
CCB Principal XinZe Return Alloc A,4668,F00000ZORA,0P0001BW1Q,,,,
CCB Principal XinZe Return Alloc C,4669,F00000ZORB,0P0001BW1R,,,,
CCB Principal Yuli Flxbl Alloc,2281,F00000ZZEJ,0P0001CIH6,,,,
CCB-Principal 14 Days Bond Fund A,530014,F00000OP7Y,0P0000WTPV,,,,
CCB-Principal 14 Days Bond Fund B,531014,F00000OP7Z,0P0000WTPW,,,,
CCB-Principal Absolute-return,150036,F00000MA3T,0P0000SR5J,,,,
CCB-Principal Advantage Dynamic Fd(LOF),165313,F00000PPKF,0P0000YBN0,,,,
CCB-Principal Aggressive-growth,150037,F00000MA3U,0P0000SR5K,,,,
CCB-Principal Biomonthly Bond Fund A,530029,F00000PCP3,0P0000XUWB,,,,
CCB-Principal Biomonthly Bond Fund B,531029,F00000PCP4,0P0000XUWC,,,,
CCB-Principal CCTV 50 Idx Struct Fd,165312,F00000PJMM,0P0000Y35C,,,,
CCB-Principal CCTV 50 Idx Struct Fd A,150123,F00000PJMN,0P0000Y35D,,,,
CCB-Principal CCTV 50 Idx Struct Fd B,150124,F00000PJMO,0P0000Y35E,,,,
CCB-Principal Consumption Upgrade Bal Fd,56,F00000PX2R,0P0000YS2C,,,,
CCB-Principal Dual-bond Enha Bd Fd A,207,F00000Q2LM,0P0000Z10C,,,,
CCB-Principal Dual-bond Enha Bd Fd C,208,F00000Q2LN,0P0000Z10D,,,,
CCB-Principal Enhanced Convert Bd Fd A,530020,F00000O5VR,0P0000VXPU,,,,
CCB-Principal Enhanced Convert Bd Fd C,531020,F00000O5VS,0P0000VXPV,,,,
CCB-Principal Glbl Resrcs Equity Fd QDII,539003,F00000OARU,0P0000W8O5,,,,
CCB-Principal Income Enhanced Fund A,530009,F000002Y0F,0P0000K8OT,,,,
CCB-Principal Income Enhanced Fund C,531009,F000002Y0G,0P0000K8OU,,,,
CCB-Principal Monthly Bond Fund A,530028,F00000P8GP,0P0000XOVU,,,,
CCB-Principal Monthly Bond Fund B,531028,F00000P8GQ,0P0000XOVV,,,,
CCB-Principal Pure Bond Fund A,530021,F00000OWSL,0P0000X6LE,,,,
CCB-Principal Pure Bond Fund C,531021,F00000OWSM,0P0000X6LF,,,,
CCB-Principal Social Rspnbility Eq Fd,530019,F00000OKCX,0P0000WHNI,,,,
CCBPrincipal SSE50 ETF Fdr A,5880,F0000119A6,0P0001EP7L,,,,
CCBPrincipal SSE50 ETF Fdr C,5881,F0000119A7,0P0001EP7M,,,,
CCB-Principal SZSE 100 Enhanced Idx Fd,530018,F00000NPPE,0P0000VCNX,,,,
CCB-Principal Tiantianyi MMKt A,3391,F00000XWQR,0P00018V7J,,,,
CCB-Principal Tiantianyi MMKt B,3392,F00000XWQS,0P00018V7K,,,,
CCB-Principal Tiantianyi MMKt C,3393,F00000XWQT,0P00018V7L,,,,
